,asin,product_title,product_price,product_original_price,currency,product_star_rating,product_num_ratings,product_url,product_photo,product_num_offers,product_minimum_offer_price,is_best_seller,is_amazon_choice,is_prime,climate_pledge_friendly,sales_volume,delivery,has_variations,unit_price,unit_count,product_availability,coupon_text
827,B0CM9X8YC9,"Fire HD 10 Kids Tablet (32GB, Blue) + Kids Stylus",$206.98,,USD,4.4,10,https://www.amazon.com/dp/B0CM9X8YC9,https://m.media-amazon.com/images/I/71b3EGszm3L._AC_UY654_FMwebp_QL65_.jpg,1,$206.98,False,False,False,False,,FREE delivery,False,,,,
828,B0067H4RAE,"Moshi Moonrock In-Ear Headphones, Pink",$29.95,$39.00,USD,3.8,188,https://www.amazon.com/dp/B0067H4RAE,https://m.media-amazon.com/images/I/51fSfJXXmyL._AC_UY654_FMwebp_QL65_.jpg,1,$29.95,False,False,True,False,List: ,"FREE delivery Tue, Oct 29 on $35 of items shipped by AmazonOr fastest delivery Mon, Oct 21 Only 1 left in stock - order soon.",False,,,Only 1 left in stock - order soon.,
829,B09BFRLZZ5,"Amazon Basics Smart A19 LED Light Bulb, Multicolor Changing, 7W (60W Equivalent), 800LM, Works with Alexa Only, 2.4 GHz Wi-Fi, No Hub Required, 1-Pack",,,,4.5,19111,https://www.amazon.com/dp/B09BFRLZZ5,https://m.media-amazon.com/images/I/7143CBtOLlL._AC_UY654_FMwebp_QL65_.jpg,1,,False,False,False,True,500+ bought in past month,,False,,,,
830,B0BXPFN2SK,"Moko Slim Sleeve Compatible with 6.8&quot; Kindle Paperwhite 2021/ Fire 7&quot; Tablet 2022, Anti-Scratch PU Leather Case Cover Soft Felt Lining Protective Insert Carrying Pouch, Black",$15.99,$21.99,USD,4.2,686,https://www.amazon.com/dp/B0BXPFN2SK,https://m.media-amazon.com/images/I/71VjPAYfNOL._AC_UY654_FMwebp_QL65_.jpg,1,$15.99,False,False,True,False,List: ,"FREE delivery Wed, Oct 23 on $35 of items shipped by AmazonOr fastest delivery Mon, Oct 21",False,,,,Save 20% with coupon
831,B0DCHD52S2,"Ring Wired Doorbell Plus with Ring Floodlight Cam Pro, White",$399.98,,USD,,0,https://www.amazon.com/dp/B0DCHD52S2,https://m.media-amazon.com/images/I/41W3Uu6OmkL._AC_UY654_FMwebp_QL65_.jpg,1,$399.98,False,False,False,False,,FREE delivery,False,,,,
832,B0D1XGX6GT,LaView 4MP Light Bulb Camera，White，10PK,$299.99,,USD,4.1,13242,https://www.amazon.com/dp/B0D1XGX6GT,https://m.media-amazon.com/images/I/71UQnvo4LdL._AC_UY654_FMwebp_QL65_.jpg,1,$299.99,False,False,True,False,($30.00$30.00/Count),"FREE delivery Tue, Oct 22",False,$30.00,10.0,,
833,B0CHLFCW48,"Ring Floodlight Cam Wired Plus, Black with Ring Video Doorbell, Satin Nickel",$299.98,,USD,4.5,27,https://www.amazon.com/dp/B0CHLFCW48,https://m.media-amazon.com/images/I/51+nNSmUDAL._AC_UY654_FMwebp_QL65_.jpg,1,$299.98,False,False,False,True,This product is certified by Amazon to work with Alexa. This product can be controlled with your voice through Alexa-enabled devices such as Amazon Echo and Amazon Tap.,FREE delivery,False,,,,
834,B0BHVGPK83,Echo (4th Gen) | Charcoal with Philips Hue Color Smart Bulb,$143.98,,USD,4.8,381,https://www.amazon.com/dp/B0BHVGPK83,https://m.media-amazon.com/images/I/51vDgZfTjxL._AC_UY500_FMwebp_QL65_.jpg,1,$143.98,False,False,False,False,,FREE delivery,False,,,,
835,B0DF15CZBS,Echo Show 10 with TP-Link Tapo Smart Color Bulb,$249.99,$274.98,USD,,0,https://www.amazon.com/dp/B0DF15CZBS,https://m.media-amazon.com/images/I/51BLrmvpgPL._AC_UY654_FMwebp_QL65_.jpg,1,$249.99,False,False,False,False,List: ,FREE delivery,False,,,,
836,B09SR451K2,Amazon eero Pro 6E system (3-pack) with $100 Amazon.com Gift Card,$649.99,,USD,4.2,6,https://www.amazon.com/dp/B09SR451K2,https://m.media-amazon.com/images/I/31AOCRrxaML._AC_UY654_FMwebp_QL65_.jpg,1,$649.99,False,False,False,False,,FREE delivery,False,,,,
837,B09WXJKYGJ,Echo Pop | Full sound compact smart speaker with Alexa | I International Version with UK Power Adaptor | Charcoal,$58.67,,USD,3.4,4,https://www.amazon.com/dp/B09WXJKYGJ,https://m.media-amazon.com/images/I/61V5FRUgX8L._AC_UY654_FMwebp_QL65_.jpg,1,$58.67,False,False,False,False,,,False,,,,
838,B0DHF6P46C,Echo Pop with WiZ Smart Color Bulb,$50.98,,USD,,0,https://www.amazon.com/dp/B0DHF6P46C,https://m.media-amazon.com/images/I/31mdNSE7M6L._AC_UY500_FMwebp_QL65_.jpg,1,$50.98,False,False,False,False,,FREE delivery,False,,,,
839,B0D54T8973,Echo Pop with Sengled Bluetooth Mesh Bulb (1 count),$48.93,$49.98,USD,4.9,101,https://www.amazon.com/dp/B0D54T8973,https://m.media-amazon.com/images/I/31MH6XLH3bL._AC_UY500_FMwebp_QL65_.jpg,1,$48.93,False,False,False,False,List: ,FREE delivery,False,,,,
840,B08S35N9FF,Ring Jobsite Security – Powered Case,$129.99,,USD,3.4,3,https://www.amazon.com/dp/B08S35N9FF,https://m.media-amazon.com/images/I/61WurO-ZZNL._AC_UY654_FMwebp_QL65_.jpg,1,$129.99,False,False,True,False,,"FREE delivery Fri, Oct 25 Or fastest delivery Tue, Oct 22",False,,,,
841,B0CX7NDCV3,"Ring Pan-Tilt Indoor Cam, White with Ring Floodlight Cam Wired Plus, White",$279.98,,USD,,0,https://www.amazon.com/dp/B0CX7NDCV3,https://m.media-amazon.com/images/I/419FyX85pHL._AC_UY654_FMwebp_QL65_.jpg,1,$279.98,False,False,False,False,,FREE delivery,False,,,,
842,B07GTMGKYV,"Certified Refurbished Ring Spotlight Cam Wired: Plugged-in HD security camera with built-in spotlights, two-way talk and a siren alarm, White, Works with Alexa",$159.99,,USD,4.6,4149,https://www.amazon.com/dp/B07GTMGKYV,https://m.media-amazon.com/images/I/71A38wgDhmL._AC_UY654_FMwebp_QL65_.jpg,1,$159.99,False,False,True,True,100+ bought in past month,"FREE delivery Tue, Oct 22 Or fastest delivery Sat, Oct 19",False,,,,
843,B07KZCYF7D,"Certified Refurbished Fire 7 Tablet, 7&quot; display, 16 GB (2019 release) - Twilight Blue",,,,4.2,8949,https://www.amazon.com/dp/B07KZCYF7D,https://m.media-amazon.com/images/I/51GJ2v38SNL._AC_UY654_FMwebp_QL65_.jpg,1,,False,False,False,False,,Currently unavailable.,True,,,,
844,B0B4BRN9H2,"Ring Home Safety Alarm Accessories with Alarm Panic Button (2nd gen), Glass Break Sensor, Smoke and CO Listener, and Flood and Freeze Sensor",$119.99,$139.96,USD,5,7,https://www.amazon.com/dp/B0B4BRN9H2,https://m.media-amazon.com/images/I/414r5jVKKJL._AC_UY654_FMwebp_QL65_.jpg,1,$119.99,False,False,False,False,Was: ,FREE delivery,False,,,,
845,B0CHX6XCFL,"Ring Wired Doorbell Pro (Video Doorbell Pro 2) with Ring Indoor Cam (2nd Gen), White",$289.98,,USD,5,13,https://www.amazon.com/dp/B0CHX6XCFL,https://m.media-amazon.com/images/I/51MQJBFjuCL._AC_UY654_FMwebp_QL65_.jpg,1,$289.98,False,False,False,True,This product is certified by Amazon to work with Alexa. This product can be controlled with your voice through Alexa-enabled devices such as Amazon Echo and Amazon Tap.,FREE delivery,False,,,,
846,B0B64MRH6S,Amazon eero 1U Rack Shelf for eero PoE Gateway,$99.99,,USD,3.8,4,https://www.amazon.com/dp/B0B64MRH6S,https://m.media-amazon.com/images/I/5116aLR0LvL._AC_UY654_FMwebp_QL65_.jpg,1,$99.99,False,False,True,False,,"FREE delivery Thu, Oct 24 Or fastest delivery Tue, Oct 22",False,,,,
847,B09XWWQM9S,"WiZ Connected 2-Pack A19 Dimmable Soft White Bulbs, Compatible with Alexa, Google Assistant, and Soft White K 2 Bulbs 603647 WiZ - A19 Smart LED Soft White Bulb 2pk",,,,4.1,339,https://www.amazon.com/dp/B09XWWQM9S,https://m.media-amazon.com/images/I/61-5m+jwpOL._AC_UY654_FMwebp_QL65_.jpg,1,,False,False,False,False,,,False,,,,
848,B0CK5GMF2X,"Fire 7 Kids Tablet (16GB, Purple) + Kids Stylus",$126.98,,USD,1,1,https://www.amazon.com/dp/B0CK5GMF2X,https://m.media-amazon.com/images/I/31OyelL-vDL._AC_UY500_FMwebp_QL65_.jpg,1,$126.98,False,False,False,False,,FREE delivery,False,,,,
849,B0C9RBVS6C,"Certified Refurbished Fire TV Cube (2nd Gen), Hands-free streaming device with Alexa, 4K Ultra HD, includes 1-Year SquareTrade Warranty",$99.99,,USD,4.6,132,https://www.amazon.com/dp/B0C9RBVS6C,https://m.media-amazon.com/images/I/51kApmaORSL._AC_UY654_FMwebp_QL65_.jpg,1,$99.99,False,False,True,False,,Temporarily out of stock.,False,,,,
850,B0CVNKJTZH,"Ring Battery Doorbell Pro with Ring Stick Up Cam Battery, White",$299.99,,USD,4.7,8,https://www.amazon.com/dp/B0CVNKJTZH,https://m.media-amazon.com/images/I/51ZjloJlsZL._AC_UY654_FMwebp_QL65_.jpg,1,$299.99,False,False,False,False,,FREE delivery,False,,,,
851,B0939T344X,Echo (4th Gen) in Charcoal bundle with TP-Link Kasa Smart Color Bulb,$110.48,$122.98,USD,4.7,87,https://www.amazon.com/dp/B0939T344X,https://m.media-amazon.com/images/I/81KsJIQKDoS._AC_UY654_FMwebp_QL65_.jpg,1,$110.48,False,False,False,False,List: ,FREE delivery,False,,,,
852,B09T38R3SR,Echo Show 10 (3rd Gen) | HD smart display with motion and Alexa | Glacier White | with Wyze Cam V3,$285.79,,USD,4.6,99,https://www.amazon.com/dp/B09T38R3SR,https://m.media-amazon.com/images/I/319hpAj-FVL._AC_UY500_FMwebp_QL65_.jpg,1,$285.79,False,False,False,False,,FREE delivery,False,,,,
853,B0CX6V84GJ,"Ring Pan-Tilt Indoor Cam, Black with Ring Stick Up Cam Plug-In, Black",$159.99,$179.98,USD,,0,https://www.amazon.com/dp/B0CX6V84GJ,https://m.media-amazon.com/images/I/41P7cdg5gTL._AC_UY654_FMwebp_QL65_.jpg,1,$159.99,False,False,False,False,Was: ,FREE delivery,False,,,,
854,B0D22R7C3N,Smart Home Bundle - Echo Show 8 + Blink Video Doorbell + Blink Outdoor 4 1-Cam System + 2 Smart Plugs,$359.95,,USD,4,3,https://www.amazon.com/dp/B0D22R7C3N,https://m.media-amazon.com/images/I/61TjTc1awwL._AC_UY654_FMwebp_QL65_.jpg,1,$359.95,False,False,False,False,,FREE delivery,False,,,,
855,B09RX3HZG8,"Echo Dot (5th Gen, 2022 release) with clock | International Version with EU Power Adaptor | Smart speaker with clock and Alexa | Glacier White",$59.99,,USD,3.6,55,https://www.amazon.com/dp/B09RX3HZG8,https://m.media-amazon.com/images/I/71e3xpEsLFL._AC_UY654_FMwebp_QL65_.jpg,1,$59.99,False,False,False,False,,,False,,,,
856,B0CCZMMYWQ,"Ring Stick Up Cam Plug-In, Black with All-new Ring Indoor Cam, Black",$159.98,,USD,4.7,33,https://www.amazon.com/dp/B0CCZMMYWQ,https://m.media-amazon.com/images/I/51yz70Fs95L._AC_UY654_FMwebp_QL65_.jpg,1,$159.98,False,False,False,True,This product is certified by Amazon to work with Alexa. This product can be controlled with your voice through Alexa-enabled devices such as Amazon Echo and Amazon Tap.,FREE delivery,False,,,,
857,B0CLKRZMK1,Echo Pop + Alexa Emergency Assist Yearly (auto-renewal) | Full sound compact smart speaker | Charcoal,$80.99,$98.99,USD,1,1,https://www.amazon.com/dp/B0CLKRZMK1,https://m.media-amazon.com/images/I/61HkLzh1WkL._AC_UY654_FMwebp_QL65_.jpg,1,$76.99,False,False,True,False,List Price: ,,False,,,,
858,B0D54T79SS,Echo Pop with Sengled Bluetooth Mesh Bulb (1 count),$48.93,$49.98,USD,4.7,74,https://www.amazon.com/dp/B0D54T79SS,https://m.media-amazon.com/images/I/31yEXte3jvL._AC_UY500_FMwebp_QL65_.jpg,1,$48.93,False,False,False,False,List: ,FREE delivery,False,,,,
859,B0CZSC116C,Echo Show 5 (3rd Gen) Smart Display Bundle with Tapo 2K Pan/Tilt Indoor Security Camera,$109.98,$124.98,USD,5,1,https://www.amazon.com/dp/B0CZSC116C,https://m.media-amazon.com/images/I/31HDrstHaFL._AC_UY500_FMwebp_QL65_.jpg,1,$109.98,False,False,False,False,List: ,FREE delivery,False,,,,
860,B0D68C7FGD,All-new Amazon Echo Spot (2024 release) in Amazon Black bundle with Amazon Smart Plug,$104.98,,USD,,0,https://www.amazon.com/dp/B0D68C7FGD,https://m.media-amazon.com/images/I/61Hnlkrr6lL._AC_UY654_FMwebp_QL65_.jpg,1,$104.98,False,False,False,False,,FREE delivery,False,,,,
861,B0CZVVGV2F,"Ring Wired Doorbell Plus with Ring Stick Up Cam, Plug-In White",$249.98,,USD,,0,https://www.amazon.com/dp/B0CZVVGV2F,https://m.media-amazon.com/images/I/515SXsEJI1L._AC_UY654_FMwebp_QL65_.jpg,1,$249.98,False,False,False,False,,FREE delivery,False,,,,
862,B0BL5RKSHH,Carrera Smart Glasses with Alexa | Smart audio glasses | Sprinter black frames with blue light filtering lenses | Square,$389.99,,USD,4,64,https://www.amazon.com/dp/B0BL5RKSHH,https://m.media-amazon.com/images/I/319IOlE99pL._AC_UY654_FMwebp_QL65_.jpg,1,$389.99,False,False,True,True,,"FREE delivery Wed, Oct 23 Or fastest delivery Fri, Oct 18",False,,,,
863,B07H8WS1FT,"Fire 7 Kids tablet, 7&quot; Display, ages 3-7, 16 GB, (2019 release), Blue Kid-Proof Case",$99.99,,USD,4.5,239549,https://www.amazon.com/dp/B07H8WS1FT,https://m.media-amazon.com/images/I/61DPuDA7ISL._AC_UY654_FMwebp_QL65_.jpg,1,$99.99,False,False,True,False,,"FREE delivery Wed, Oct 23 Or fastest delivery Sun, Oct 20 Only 2 left in stock - order soon.",True,,,Only 2 left in stock - order soon.,
864,B0CZW2GVPS,"Ring Floodlight Cam Plus with Ring Stick Up Cam, Plug-In White",$299.98,,USD,4.7,4,https://www.amazon.com/dp/B0CZW2GVPS,https://m.media-amazon.com/images/I/41UDV-0zeRL._AC_UY654_FMwebp_QL65_.jpg,1,$299.98,False,False,False,False,,FREE delivery,False,,,,
865,B0758L64L9,"Ring Spotlight Cam Battery HD Security Camera with Built Two-Way Talk and a Siren Alarm, Works with Alexa - White",,,,4.6,38478,https://www.amazon.com/dp/B0758L64L9,https://m.media-amazon.com/images/I/51lI-VB7rFL._AC_UY654_FMwebp_QL65_.jpg,1,,False,False,False,True,This product is certified by Amazon to work with Alexa. This product can be controlled with your voice through Alexa-enabled devices such as Amazon Echo and Amazon Tap.,Currently unavailable.,False,,,,
866,B0CDB5BQD8,"Ring Stick Up Cam Battery with Pan-Tilt, Black (Power adapter and camera included)",$139.99,,USD,4.4,7,https://www.amazon.com/dp/B0CDB5BQD8,https://m.media-amazon.com/images/I/61qub1cFM1L._AC_UY654_FMwebp_QL65_.jpg,1,$139.99,False,False,False,False,,FREE delivery,False,,,,
867,B00IU7CEV8,Incipio Journal Solid,$29.99,,USD,3.7,125,https://www.amazon.com/dp/B00IU7CEV8,https://m.media-amazon.com/images/I/818uBuThqcL._AC_UY654_FMwebp_QL65_.jpg,1,$29.99,False,False,True,False,,"FREE delivery Sat, Oct 26 on $35 of items shipped by AmazonOr fastest delivery Mon, Oct 21",False,,,,
868,B00LNTLK9C,"Incipio Standing Folio Case for Amazon Fire HD 7 (only fits 4th Generation Fire HD 7), Black",$29.99,,USD,4,102,https://www.amazon.com/dp/B00LNTLK9C,https://m.media-amazon.com/images/I/813mUGWdyTL._AC_UY654_FMwebp_QL65_.jpg,1,$29.99,False,False,True,False,Also available in Orchid,"FREE delivery Thu, Oct 24 on $35 of items shipped by AmazonOr fastest delivery Mon, Oct 21",False,,,,
869,B0CZSBV8LG,Echo Show 5 (3rd Gen) Smart Display Bundle with Tapo 2K Pan/Tilt Indoor Security Camera,$109.98,$124.98,USD,5,1,https://www.amazon.com/dp/B0CZSBV8LG,https://m.media-amazon.com/images/I/317r9+kvHKL._AC_UY500_FMwebp_QL65_.jpg,1,$109.98,False,False,False,False,List: ,FREE delivery,False,,,,
870,B0CZWD4SVZ,"Ring Wired Doorbell Pro with Ring Spotlight Cam Plus, Plug-In White",$399.98,,USD,,0,https://www.amazon.com/dp/B0CZWD4SVZ,https://m.media-amazon.com/images/I/512cMZhA86L._AC_UY654_FMwebp_QL65_.jpg,1,$399.98,False,False,False,False,,FREE delivery,False,,,,
871,B0149EDAM2,"Verso Kindle Case - Scholar Classic Purple Composition Book Folio Style Protective Case for Amazon Kindle (fits Kindle Paperwhite, Kindle, and Kindle Touch), Purple",$29.99,,USD,3.6,149,https://www.amazon.com/dp/B0149EDAM2,https://m.media-amazon.com/images/I/71VlB2c9g1L._AC_UY654_FMwebp_QL65_.jpg,1,$29.99,False,False,True,False,,"FREE delivery Wed, Oct 23 on $35 of items shipped by AmazonOr fastest delivery Mon, Oct 21",False,,,,
872,B0CZW8MKRD,"Ring Wired Doorbell Plus with Ring Stick Up Cam, Battery White",$249.98,,USD,5,1,https://www.amazon.com/dp/B0CZW8MKRD,https://m.media-amazon.com/images/I/51sZejS0ZeL._AC_UY654_FMwebp_QL65_.jpg,1,$249.98,False,False,False,False,,FREE delivery,False,,,,
873,B013KPFUKQ,"Incipio Clarion Folio Fire HD 8 Case (Previous Generation - 2015 release), Cyan Blue",$24.99,,USD,4,495,https://www.amazon.com/dp/B013KPFUKQ,https://m.media-amazon.com/images/I/A1e1yn7pVCL._AC_UY654_FMwebp_QL65_.jpg,2,$23.99,False,False,True,False,More Buying Choices,"FREE delivery Tue, Oct 22 on $35 of items shipped by AmazonOr fastest delivery Fri, Oct 18",False,,,,
874,B07G1MR7MP,2-Year Accident Protection for Echo Auto,$5.99,,USD,,0,https://www.amazon.com/dp/B07G1MR7MP,https://m.media-amazon.com/images/I/51aZrvx0IFL._AC_UY654_FMwebp_QL65_.jpg,1,$5.99,False,False,False,False,,FREE delivery Oct 22 - 24,False,,,,
875,B0DGQYCCS4,Echo Dot with Globe Electric Smart Bulb,$61.98,,USD,,0,https://www.amazon.com/dp/B0DGQYCCS4,https://m.media-amazon.com/images/I/21QPCiJLwFL._AC_UY500_FMwebp_QL65_.jpg,1,$61.98,False,False,False,False,,FREE delivery,False,,,,
876,B0CZVXLHXQ,"Ring Video Doorbell (Satin Nickel) with Spotlight Cam Plus, Plug-In White",$269.98,,USD,4.6,3,https://www.amazon.com/dp/B0CZVXLHXQ,https://m.media-amazon.com/images/I/51LBx0LD7yL._AC_UY654_FMwebp_QL65_.jpg,1,$269.98,False,False,False,False,,FREE delivery,False,,,,
877,B09B9CX8PW,"Echo Dot (5th Gen, 2022 release) | International Version with EU Power Adaptor | Smart speaker with Alexa | Charcoal",$49.99,,USD,4.7,19,https://www.amazon.com/dp/B09B9CX8PW,https://m.media-amazon.com/images/I/71xoR4A6q-L._AC_UY654_FMwebp_QL65_.jpg,1,$49.99,False,False,False,False,,,False,,,,
878,B0DG9P7WCJ,"eero Max 7 mesh wifi system | Wireless speeds up to 4.3 Gbps | Coverage up to 10,000 sq. ft. | Connect 200+ devices | Ideal for gaming | 4-pack | Latest gen","$2,304.97",,USD,,0,https://www.amazon.com/dp/B0DG9P7WCJ,https://m.media-amazon.com/images/I/51aeWbsiqrL._AC_UY654_FMwebp_QL65_.jpg,1,"$2,304.97",False,False,False,False,,FREE delivery,False,,,,
879,B08PFVMY1C,"Star Wars The Mandalorian Remote Cover, for Fire TV Alexa Voice Remote Gen 2 (Grogu Green)",$19.99,,USD,4.5,767,https://www.amazon.com/dp/B08PFVMY1C,https://m.media-amazon.com/images/I/71iXpxxawYL._AC_UY654_FMwebp_QL65_.jpg,1,$19.99,False,False,True,False,,"FREE delivery Mon, Oct 21 on $35 of items shipped by AmazonOr fastest delivery Fri, Oct 18",False,,,,
880,B0DF15JS44,Echo Show 10 with TP-Link Tapo Smart Color Bulb,$249.99,$274.98,USD,1,1,https://www.amazon.com/dp/B0DF15JS44,https://m.media-amazon.com/images/I/51vos6YY-HL._AC_UY654_FMwebp_QL65_.jpg,1,$249.99,False,False,False,False,List: ,FREE delivery,False,,,,
881,B0C3S4TG9P,Amazon Fire TV 65&quot; Omni QLED Series 4K UHD smart TV + 4-Year Protection Plan,$819.98,$959.98,USD,4.7,10,https://www.amazon.com/dp/B0C3S4TG9P,https://m.media-amazon.com/images/I/517qIqIv3TL._AC_UY654_FMwebp_QL65_.jpg,1,$819.98,False,False,True,False,List: ,,False,,,,
882,B0D9321S79,Ring Battery Doorbell with Ring Spotlight Cam Plus Battery (Black),$249.99,$269.98,USD,,0,https://www.amazon.com/dp/B0D9321S79,https://m.media-amazon.com/images/I/61jyN5pxxJL._AC_UY654_FMwebp_QL65_.jpg,1,$249.99,False,False,False,False,Was: ,FREE delivery,False,,,,
883,B00QR2YGA0,Eangee Home Design Celebrations Inliten-K Led C9 Fctd Bulbs Mlt5pk,$7.83,,USD,,0,https://www.amazon.com/dp/B00QR2YGA0,https://m.media-amazon.com/images/I/518d1N2-pXL._AC_UY500_FMwebp_QL65_.jpg,10,$7.78,False,False,False,True,Shop products from small business brands sold in Amazon’s store. Discover more about the small businesses partnering with Amazon and Amazon’s commitment to empowering them.,"FREE delivery Wed, Oct 23",False,,,,
884,B0CK5BKXCX,"Fire 7 Kids Tablet (16GB, Red) + Kids Stylus",$126.98,,USD,4.5,7,https://www.amazon.com/dp/B0CK5BKXCX,https://m.media-amazon.com/images/I/31YxQoWfh+L._AC_UY500_FMwebp_QL65_.jpg,1,$126.98,False,False,False,False,,FREE delivery,False,,,,
885,B0D5RLKY76,"Amazon Fire HD 8 Plus tablet, 8&quot; HD Display, 64 GB, bundle with Wireless Charging Dock - (2022 release), Gray",$189.98,$199.98,USD,4.7,5,https://www.amazon.com/dp/B0D5RLKY76,https://m.media-amazon.com/images/I/51DC+DE8m9L._AC_UY654_FMwebp_QL65_.jpg,1,$189.98,False,False,False,False,List: ,FREE delivery,False,,,,
886,B0DJDP4PDB,"New Amazon Fire HD 8 Kids Tablet (32 GB, Grape, 6 months Kids+, 2024 release) + Backpack Bundle",$159.98,$164.98,USD,,0,https://www.amazon.com/dp/B0DJDP4PDB,https://m.media-amazon.com/images/I/4122Pv-gtZL._AC_UY500_FMwebp_QL65_.jpg,1,$159.98,False,False,False,False,List: ,FREE delivery,False,,,,
887,B0CYS8BFPT,"Echo Show 8 Bundle: Includes, Echo Show 8 (3rd Gen, 2023 release) | Charcoal and Made for Amazon Battery Base | Charcoal",$199.98,,USD,5,1,https://www.amazon.com/dp/B0CYS8BFPT,https://m.media-amazon.com/images/I/71iozvfiguL._AC_UY654_FMwebp_QL65_.jpg,1,$199.98,False,False,False,False,,FREE delivery,False,,,,
888,B091N4KDWL,"Amazon eero 6 dual-band mesh Wi-Fi 6 system with built-in Zigbee smart home hub (5-pack, three routers and two extenders)",$377.99,,USD,4.5,66,https://www.amazon.com/dp/B091N4KDWL,https://m.media-amazon.com/images/I/41utoolTE3L._AC_UY654_FMwebp_QL65_.jpg,1,$377.99,False,False,False,False,,FREE delivery,False,,,,
889,B075DDTHGV,Replacement Remote Control for Technics SA-GX490,$20.72,,USD,5,4,https://www.amazon.com/dp/B075DDTHGV,https://m.media-amazon.com/images/I/91dx9pNqkoL._AC_UY654_FMwebp_QL65_.jpg,1,$20.72,False,False,False,True,Shop products from small business brands sold in Amazon’s store. Discover more about the small businesses partnering with Amazon and Amazon’s commitment to empowering them.,FREE delivery Oct 22 - 24,False,,,,
890,B0CW3TJPCW,"2 Ring Indoor Cam (2nd Gen), Black with 2 Ring Pet Tag",$109.99,,USD,4.9,10,https://www.amazon.com/dp/B0CW3TJPCW,https://m.media-amazon.com/images/I/51sM17btMiL._AC_UY654_FMwebp_QL65_.jpg,1,$109.99,False,False,False,True,This product is certified by Amazon to work with Alexa. This product can be controlled with your voice through Alexa-enabled devices such as Amazon Echo and Amazon Tap.,FREE delivery,False,,,,
891,B07XKF6GQ9,1-Year Accident Protection Plan for All New Echo Dot 4th Gen,$3.99,,USD,4.3,85,https://www.amazon.com/dp/B07XKF6GQ9,https://m.media-amazon.com/images/I/51NarbrWD9L._AC_UY654_FMwebp_QL65_.jpg,1,$3.99,False,False,False,False,,FREE delivery Oct 22 - 24,False,,,,
892,B0CYR83YWT,"Ring Floodlight Cam Wired Pro, Black with Ring Video Doorbell Pro 2",$419.99,,USD,5,2,https://www.amazon.com/dp/B0CYR83YWT,https://m.media-amazon.com/images/I/31g-50T46ZS._AC_UY654_FMwebp_QL65_.jpg,1,$419.99,False,False,False,False,,FREE delivery,False,,,,
893,B07P5VPJTT,Fire HD 10 Tablet (10.1&quot; 1080p full HD display 64 GB) – Black – Without Lockscreen Ads (2019 Release),,,,4.4,7888,https://www.amazon.com/dp/B07P5VPJTT,https://m.media-amazon.com/images/I/71glhH4ms9L._AC_UY654_FMwebp_QL65_.jpg,1,,False,False,False,False,,,False,,,,
894,B0842BYVSY,"Solar Charger for Ring Video Doorbell 3, Ring Video Doorbell 3 Plus, and Ring Video Doorbell 4",,,,3.9,9491,https://www.amazon.com/dp/B0842BYVSY,https://m.media-amazon.com/images/I/51ON-+rugSL._AC_UY654_FMwebp_QL65_.jpg,1,,False,False,False,False,,Currently unavailable.,False,,,,
895,B00F3HGZL8,Belkin Extra Long 10-Foot / 3-Meter Micro USB Cable (Black),,,,4,250,https://www.amazon.com/dp/B00F3HGZL8,https://m.media-amazon.com/images/I/61eo0sgCG3L._AC_UY654_FMwebp_QL65_.jpg,1,,False,False,False,False,Price may vary by color,,False,,,,
896,B0CX7YQWYD,"Ring Pan-Tilt Indoor Cam, White with Ring Battery Doorbell Plus, Satin Nickel",$229.98,,USD,,0,https://www.amazon.com/dp/B0CX7YQWYD,https://m.media-amazon.com/images/I/416hnIZJ1VL._AC_UY654_FMwebp_QL65_.jpg,1,$229.98,False,False,False,False,,FREE delivery,False,,,,
897,B09T38V3PX,Echo Show 10 (3rd Gen) | HD smart display with motion and Alexa | Charcoal | with Wyze Cam V3,$285.79,,USD,4.8,102,https://www.amazon.com/dp/B09T38V3PX,https://m.media-amazon.com/images/I/31nMYTilTnL._AC_UY500_FMwebp_QL65_.jpg,1,$285.79,False,False,False,False,,FREE delivery,False,,,,
898,B071KLHWSP,"Kwikset Convert Smart Lock Conversion Kit (Amazon Key Edition – Amazon Cloud Cam required), Compatible with Alexa in Venetian Bronze",$58.99,,USD,3.1,894,https://www.amazon.com/dp/B071KLHWSP,https://m.media-amazon.com/images/I/81YvPlxLIuL._AC_UY654_FMwebp_QL65_.jpg,6,$44.00,False,False,False,False,More Buying Choices,FREE delivery Oct 23 - 25 Only 7 left in stock - order soon.,False,,,Only 7 left in stock - order soon.,
899,B0DGQXRDPJ,Echo Pop with Globe Electric,$51.98,,USD,,0,https://www.amazon.com/dp/B0DGQXRDPJ,https://m.media-amazon.com/images/I/31m+fVof2SL._AC_UY500_FMwebp_QL65_.jpg,1,$51.98,False,False,False,False,,FREE delivery,False,,,,
900,B0DB6D64G4,"Blue Buffalo Bits Soft &amp; Chewy Dog Treats, Chicken Recipe, 11-oz. Bag + Ring Pet Tag",$17.97,$19.97,USD,,0,https://www.amazon.com/dp/B0DB6D64G4,https://m.media-amazon.com/images/I/81McDdXBSDL._AC_UY654_FMwebp_QL65_.jpg,1,$17.97,False,False,False,False,Was: ,FREE delivery on $35 shipped by Amazon.,False,,,,
901,B0CZW2GK1H,"Ring Floodlight Cam Plus with Ring Spotlight Cam Plus, Plug-In White",$369.98,,USD,4,5,https://www.amazon.com/dp/B0CZW2GK1H,https://m.media-amazon.com/images/I/414n-65Q3ZL._AC_UY654_FMwebp_QL65_.jpg,1,$369.98,False,False,False,False,,FREE delivery,False,,,,
902,B013KPFPUG,"Incipio Clarion Folio Fire Case (5th Generation - 2015 release), Citron Green",$19.99,,USD,4.4,595,https://www.amazon.com/dp/B013KPFPUG,https://m.media-amazon.com/images/I/91Yc-al0ccL._AC_UY654_FMwebp_QL65_.jpg,1,$19.99,False,False,True,False,Also available in Pink,"FREE delivery Mon, Oct 28 on $35 of items shipped by AmazonOr fastest delivery Wed, Oct 23 Only 12 left in stock - order soon.",False,,,Only 12 left in stock - order soon.,
903,B00VVNG4OG,"NuPro Protective Comfort Grip for Kindle (7th Generation, 2015), Purple - will not fit 8th Generation or previous generation Kindle devices or Kindle Paperwhite",$21.99,,USD,4.1,469,https://www.amazon.com/dp/B00VVNG4OG,https://m.media-amazon.com/images/I/915GdtRqtIL._AC_UY654_FMwebp_QL65_.jpg,1,$21.99,False,False,True,False,,"FREE delivery Wed, Oct 23 on $35 of items shipped by AmazonOr fastest delivery Sun, Oct 20",False,,,,
904,B086X89NJX,"NuPro Clear Screen Protector for Amazon Fire HD 8 tablet and Fire HD 8 Plus tablet (10th generation, 2020 release), 2-pack",,,,4.6,13938,https://www.amazon.com/dp/B086X89NJX,https://m.media-amazon.com/images/I/61J9Evtc86L._AC_UY654_FMwebp_QL65_.jpg,1,,False,False,False,False,,,False,,,,
