,asin,product_title,product_price,product_original_price,currency,product_star_rating,product_num_ratings,product_url,product_photo,product_num_offers,product_minimum_offer_price,is_best_seller,is_amazon_choice,is_prime,climate_pledge_friendly,sales_volume,delivery,has_variations,unit_price,unit_count,product_availability,coupon_text
0,B0CN3XR57P,"Introducing Amazon Kindle Colorsoft Signature Edition (32 GB) – With color display, auto-adjusting front light, wireless charging, and long battery life - Metallic Black",$279.99,,USD,,0,https://www.amazon.com/dp/B0CN3XR57P,https://m.media-amazon.com/images/I/710DKsFSagL._AC_UY654_FMwebp_QL65_.jpg,1,$279.99,False,False,True,False,7K+ bought in past month,"FREE delivery Mon, Nov 4 Or fastest delivery Fri, Nov 1 This item will be released on October 30, 2024.",False,,,,
1,B0CNVCQZG1,"New Amazon Kindle (16 GB) - Lightest and most compact Kindle, with glare-free display, faster page turns, adjustable front light, and long battery life - Matcha",$109.99,,USD,5,1,https://www.amazon.com/dp/B0CNVCQZG1,https://m.media-amazon.com/images/I/51jbB7VdmmL._AC_UY654_FMwebp_QL65_.jpg,1,$109.99,False,False,True,False,500+ bought in past month,"FREE delivery Tue, Oct 22 Or fastest delivery Sat, Oct 19",False,,,,
2,B0CZB9Z477,New Amazon Kindle Scribe (64GB) - Redesigned display with uniform borders. Now write directly on books and documents. With built-in notebook summarization. Includes Premium Pen - Metallic Jade,$449.99,,USD,,0,https://www.amazon.com/dp/B0CZB9Z477,https://m.media-amazon.com/images/I/71Xoy94ij1L._AC_UY654_FMwebp_QL65_.jpg,1,$449.99,False,False,True,True,100+ bought in past month,"FREE delivery Thu, Dec 19 Or fastest delivery Thu, Dec 12 This item will be released on December 4, 2024.",False,,,,
3,B0CJM1GNFQ,"Amazon Fire TV Stick 4K with AI-powered Fire TV Search, Wi-Fi 6, stream over 1.5 million movies and shows, free &amp; live TV",$49.99,,USD,4.7,41735,https://www.amazon.com/dp/B0CJM1GNFQ,https://m.media-amazon.com/images/I/417H5BZf2LL._AC_UY654_FMwebp_QL65_.jpg,1,$49.99,True,False,True,False,10K+ bought in past month,"FREE delivery Tue, Oct 22 Or fastest delivery Sat, Oct 19",False,,,,
4,B0C8RR4WN3,"All-new Amazon Kindle Paperwhite Signature Edition (32 GB) – Our fastest Kindle with auto-adjusting front light, wireless charging, and weeks of battery life – Metallic Black",$199.99,,USD,4,2,https://www.amazon.com/dp/B0C8RR4WN3,https://m.media-amazon.com/images/I/710-budOI2L._AC_UY654_FMwebp_QL65_.jpg,1,$199.99,False,False,True,True,500+ bought in past month,"FREE delivery Wed, Oct 23 Or fastest delivery Mon, Oct 21",False,,,,
5,B0CT2N9MBQ,"All New, Made for Amazon, Wireless Charging Dock for Kindle Paperwhite Signature Editions (2022 &amp; 2024 Releases) and Kindle Colorsoft Signature Edition (2024 Release)",$39.99,,USD,,0,https://www.amazon.com/dp/B0CT2N9MBQ,https://m.media-amazon.com/images/I/81S-GuPuGxL._AC_UY654_FMwebp_QL65_.jpg,1,$39.99,False,False,True,False,,"FREE delivery Mon, Oct 21 Or fastest delivery Fri, Oct 18",False,,,,
6,B0BZWRLRLK,"All-new Ring Battery Doorbell — Now with 66% more coverage, Head-to-Toe Video, Live View with Two-Way Talk, and Motion Detection &amp; Alerts (2024 release), Venetian Bronze",$99.99,,USD,4.3,409,https://www.amazon.com/dp/B0BZWRLRLK,https://m.media-amazon.com/images/I/61TLneKHd+L._AC_UY654_FMwebp_QL65_.jpg,1,$99.99,False,False,True,True,10K+ bought in past month,"FREE delivery Mon, Oct 21 Or fastest delivery Fri, Oct 18",False,,,,
7,B0CFPTK5JG,"All-new Amazon Kindle Paperwhite (16 GB) – Our fastest Kindle ever, with new 7&quot; glare-free display and weeks of battery life – Raspberry",$159.99,,USD,3.9,8,https://www.amazon.com/dp/B0CFPTK5JG,https://m.media-amazon.com/images/I/711DIBehMTL._AC_UY654_FMwebp_QL65_.jpg,1,$159.99,False,False,True,True,500+ bought in past month,"FREE delivery Wed, Oct 23",False,,,,
8,B0DGNSVTFK,"Introducing All-New Amazon Plant-Based Leather Case- Lightweight, Protective Cover Designed with Sustainability in Mind for All-new Kindle Paperwhite and Kindle Colorsoft Signature Edition",$42.99,,USD,,0,https://www.amazon.com/dp/B0DGNSVTFK,https://m.media-amazon.com/images/I/71ueWn-ouUL._AC_UY654_FMwebp_QL65_.jpg,1,$42.99,True,False,True,False,1K+ bought in past month,"FREE delivery Fri, Oct 25 Or fastest delivery Tue, Oct 22",False,,,,
9,B0DGNVSYR5,"All-new Amazon Kindle Paperwhite and Kindle Colorsoft Signature Edition Case, Lightweight and Water-Safe, Foldable Protective Cover - Fabric",$36.99,,USD,,0,https://www.amazon.com/dp/B0DGNVSYR5,https://m.media-amazon.com/images/I/91KwBwyXicL._AC_UY654_FMwebp_QL65_.jpg,1,$36.99,False,False,True,False,500+ bought in past month,"FREE delivery Fri, Oct 25 Or fastest delivery Tue, Oct 22",False,,,,
10,B01EZV35QU,"Kasa Smart Light Switch HS200, Single Pole, Needs Neutral Wire, 2.4GHz Wi-Fi Light Switch Works with Alexa and Google Home, UL Certified, No Hub Required , White, HS200",$12.99,$19.99,USD,4.6,61564,https://www.amazon.com/dp/B01EZV35QU,https://m.media-amazon.com/images/I/611JGGx4DPL._AC_UY654_FMwebp_QL65_.jpg,11,$9.31,False,False,True,True,6K+ bought in past month,"FREE delivery Mon, Oct 21 on $35 of items shipped by AmazonOr fastest delivery Fri, Oct 18",False,,,,
11,B0DGNZ372J,"All-new Amazon Kindle Paperwhite and Kindle Colorsoft Signature Edition Case, Lightweight and Foldable Protective Cover - Premium Leather",$64.99,,USD,,0,https://www.amazon.com/dp/B0DGNZ372J,https://m.media-amazon.com/images/I/81eT7nsvm8L._AC_UY654_FMwebp_QL65_.jpg,1,$64.99,False,False,True,False,400+ bought in past month,"FREE delivery Thu, Oct 24 Or fastest delivery Tue, Oct 22",False,,,,
12,B0B6GLQJMV,Ring Indoor Cam (newest model) | Home or business security in 1080p HD video | White,$59.99,,USD,4.7,21408,https://www.amazon.com/dp/B0B6GLQJMV,https://m.media-amazon.com/images/I/51keHnu-7YL._AC_UY654_FMwebp_QL65_.jpg,3,$44.99,False,False,True,True,10K+ bought in past month,"FREE delivery Mon, Oct 21 Or fastest delivery Fri, Oct 18",True,,,,
13,B0BFC7WQ6R,"All-new Amazon Echo Spot (2024 release), Smart alarm clock with vibrant sound + Alexa, no visual ads, Black",$79.99,,USD,4.6,11378,https://www.amazon.com/dp/B0BFC7WQ6R,https://m.media-amazon.com/images/I/61TuF2ElKgL._AC_UY654_FMwebp_QL65_.jpg,1,$79.99,False,False,True,True,10K+ bought in past month,"FREE delivery Mon, Oct 21 Or fastest delivery Fri, Oct 18",True,,,,
14,B0BP9SNVH9,"Amazon Fire TV Stick 4K Max streaming device, supports Wi-Fi 6E, free &amp; live TV without cable or satellite.",$59.99,,USD,4.6,35593,https://www.amazon.com/dp/B0BP9SNVH9,https://m.media-amazon.com/images/I/41P0qtzxWSL._AC_UY654_FMwebp_QL65_.jpg,1,$59.99,False,False,True,True,10K+ bought in past month,"FREE delivery Wed, Oct 23 Or fastest delivery Sat, Oct 19",False,,,,
15,B0B1N5HW22,"Blink Outdoor 4 – Wireless smart security camera, two-year battery, 1080p HD day and infrared night live view, two-way talk – 1 camera system",$99.99,,USD,4.2,21317,https://www.amazon.com/dp/B0B1N5HW22,https://m.media-amazon.com/images/I/41hbmiP+77L._AC_UY654_FMwebp_QL65_.jpg,1,$99.99,True,False,True,True,10K+ bought in past month,"FREE delivery Wed, Oct 23 Or fastest delivery Mon, Oct 21",False,,,,
16,B0DG11DGXC,2-Year Protection Plan for Kindle,$36.99,,USD,,0,https://www.amazon.com/dp/B0DG11DGXC,https://m.media-amazon.com/images/I/61pr8jEqv6L._AC_UY654_FMwebp_QL65_.jpg,1,$36.99,False,False,False,False,200+ bought in past month,"FREE delivery Nov 4 - 6 This item will be released on October 30, 2024.",False,,,,
17,B08C1W5N87,"Amazon Fire TV Stick, HD, sharp picture quality, fast streaming, free &amp; live TV, Alexa Voice Remote with TV controls",$39.99,,USD,4.7,499123,https://www.amazon.com/dp/B08C1W5N87,https://m.media-amazon.com/images/I/51TjJOTfslL._AC_UY654_FMwebp_QL65_.jpg,1,$39.99,False,False,True,True,10K+ bought in past month,"FREE delivery Wed, Oct 23 Or fastest delivery Fri, Oct 18",False,,,,
18,B0CX4XSY3X,"Amazon Kindle Case, Thin and Lightweight, Foldable Protective Cover - Fabric",$31.99,,USD,4.7,3022,https://www.amazon.com/dp/B0CX4XSY3X,https://m.media-amazon.com/images/I/711+7nOVHnL._AC_UY654_FMwebp_QL65_.jpg,4,$30.39,False,False,True,False,100+ bought in past month,"FREE delivery Mon, Oct 21 on $35 of items shipped by AmazonOr fastest delivery Fri, Oct 18",False,,,,
19,B0D693NPQJ,"All New, Antiglare Screen Protector (2 Pack), for Amazon Kindle Paperwhite (2024 Releases) and Kindle Colorsoft (2024 Release)",$16.99,,USD,,0,https://www.amazon.com/dp/B0D693NPQJ,https://m.media-amazon.com/images/I/31D0KvAUUHL._AC_UY654_FMwebp_QL65_.jpg,1,$16.99,False,False,True,False,,"FREE delivery Fri, Oct 25 on $35 of items shipped by AmazonOr fastest delivery Tue, Oct 22",False,,,,
20,B09ZXLRRHY,"Amazon Echo Pop | Alexa fits in anywhere: bedroom, living room, bathroom, office, and small spaces | Glacier White",$39.99,,USD,4.7,66537,https://www.amazon.com/dp/B09ZXLRRHY,https://m.media-amazon.com/images/I/71NiE-BNlFL._AC_UY654_FMwebp_QL65_.jpg,1,$39.99,False,False,True,True,10K+ bought in past month,"FREE delivery Tue, Oct 22 Or fastest delivery Sat, Oct 19",True,,,,
21,B0C5QRZ47P,"Ring Stick Up Cam Battery | Weather-Resistant Outdoor Camera, Live View, Color Night Vision, Two-way Talk, Motion alerts, Works with Alexa | White",$99.99,,USD,4.6,70715,https://www.amazon.com/dp/B0C5QRZ47P,https://m.media-amazon.com/images/I/41EMzkDF2KL._AC_UY654_FMwebp_QL65_.jpg,3,$71.24,False,False,True,True,10K+ bought in past month,"FREE delivery Mon, Oct 21 Or fastest delivery Fri, Oct 18",True,,,,
22,B0BWWZXWPL,"Blink Mini 2 — Plug-in smart security camera, HD night view in color, built-in spotlight, two-way audio, motion detection, Works with Alexa (White)",$39.99,,USD,4.4,3028,https://www.amazon.com/dp/B0BWWZXWPL,https://m.media-amazon.com/images/I/31tp0vzZwRL._AC_UY654_FMwebp_QL65_.jpg,2,$35.99,False,False,True,True,10K+ bought in past month,"FREE delivery Tue, Oct 22 Or fastest delivery Sat, Oct 19",True,,,,
23,B08SG2MS3V,"Blink Video Doorbell | Two-way audio, HD video, motion and chime app alerts and Alexa enabled — wired or wire-free (Black)",$59.99,,USD,4.2,150673,https://www.amazon.com/dp/B08SG2MS3V,https://m.media-amazon.com/images/I/41te-uzWxDL._AC_UY654_FMwebp_QL65_.jpg,2,$24.14,True,False,True,True,10K+ bought in past month,"FREE delivery Wed, Oct 23 Or fastest delivery Sat, Oct 19",True,,,,
24,B0BLS3Y632,"Amazon Echo Show 8 (3rd Gen, 2023 release) | With Spatial Audio, Smart Home Hub, and Alexa | Charcoal",$149.99,,USD,4.5,13609,https://www.amazon.com/dp/B0BLS3Y632,https://m.media-amazon.com/images/I/51B0KzSAh2L._AC_UY654_FMwebp_QL65_.jpg,1,$149.99,False,True,True,True,10K+ bought in past month,"FREE delivery Mon, Oct 21 Or fastest delivery Fri, Oct 18",True,,,,
25,B0D5KKYKLZ,"Introducing All-New Plant-Based Leather Folio Cover with Magnetic Attach, Designed with Sustainability in Mind for New Amazon Kindle Scribe",$69.99,,USD,,0,https://www.amazon.com/dp/B0D5KKYKLZ,https://m.media-amazon.com/images/I/71eXMbjWkzL._AC_UY654_FMwebp_QL65_.jpg,1,$69.99,False,False,True,False,50+ bought in past month,"FREE delivery Wed, Dec 18 Or fastest delivery Thu, Dec 12 This item will be released on December 4, 2024.",False,,,,
26,B0BTTVRWPR,INSIGNIA 50-inch Class F30 Series LED 4K UHD Smart Fire TV with Alexa Voice Remote (NS-50F301NA24),$229.99,$299.99,USD,4.4,13423,https://www.amazon.com/dp/B0BTTVRWPR,https://m.media-amazon.com/images/I/81DM+ZzL8rL._AC_UY654_FMwebp_QL65_.jpg,1,$229.99,False,False,False,False,10K+ bought in past month,FREE delivery Oct 21 - 24 Or FREE pickup Tomorrow ready by 12 PM,False,,,,
27,B09B94RL1R,"Amazon Echo Dot (5th Gen, 2022 release) | With bigger vibrant sound, helpful routines and Alexa | Glacier White",$49.99,,USD,4.6,128507,https://www.amazon.com/dp/B09B94RL1R,https://m.media-amazon.com/images/I/41F4LmKQeoL._AC_UY654_FMwebp_QL65_.jpg,1,$49.99,False,False,False,True,10K+ bought in past month,FREE delivery,True,,,,
28,B0CG5VDC8P,"Amazon Basics Smart A19 LED Light Bulb, Color Changing, 9W (60W Equivalent), 800LM, Works with Alexa Only, 2.4 GHz Wi-Fi, No Hub Required, 1-Pack",$12.99,,USD,4.4,6147,https://www.amazon.com/dp/B0CG5VDC8P,https://m.media-amazon.com/images/I/71InrzITFhL._AC_UY654_FMwebp_QL65_.jpg,14,$11.49,False,False,True,True,10K+ bought in past month,"FREE delivery Tue, Oct 22 on $35 of items shipped by AmazonOr fastest delivery Fri, Oct 18",False,,,,
29,B09B2SBHQK,"Amazon Echo Show 5 (3rd Gen, 2023 release) | Smart display with 2x the bass and clearer sound | Charcoal",$89.99,,USD,4.4,35257,https://www.amazon.com/dp/B09B2SBHQK,https://m.media-amazon.com/images/I/51CYzU8PL4L._AC_UY654_FMwebp_QL65_.jpg,2,$59.70,False,False,True,True,10K+ bought in past month,"FREE delivery Tue, Oct 22 Or fastest delivery Fri, Oct 18",True,,,,
30,B0BHZT5S12,"Amazon Fire HD 10 tablet (newest model) built for relaxation, 10.1&quot; vibrant Full HD screen, octa-core processor, 3 GB RAM, 32 GB, Black",$139.99,,USD,4.5,15282,https://www.amazon.com/dp/B0BHZT5S12,https://m.media-amazon.com/images/I/5160oIUsG8L._AC_UY654_FMwebp_QL65_.jpg,1,$139.99,False,False,True,True,10K+ bought in past month,"FREE delivery Mon, Oct 21 Or fastest delivery Fri, Oct 18",False,,,,
31,B0B1N4LM4J,"Blink Outdoor 4 – Wireless smart security camera, two-year battery, 1080p HD day and infrared night live view, two-way talk – 5 camera system",$399.99,,USD,4.1,3698,https://www.amazon.com/dp/B0B1N4LM4J,https://m.media-amazon.com/images/I/41Op5wMrmpL._AC_UY654_FMwebp_QL65_.jpg,1,$399.99,True,False,True,True,10K+ bought in past month,"FREE delivery Tue, Oct 22 Or fastest delivery Fri, Oct 18",False,,,,
32,B0C8S1Q6G7,2-Year Protection Plan for Kindle Paperwhite,$25.99,,USD,,0,https://www.amazon.com/dp/B0C8S1Q6G7,https://m.media-amazon.com/images/I/615JiwTUG4L._AC_UY654_FMwebp_QL65_.jpg,1,$25.99,False,False,False,False,100+ bought in past month,FREE delivery Oct 22 - 24,False,,,,
33,B091GJ72FP,"Certified Refurbished Fire TV Stick Lite, free and live TV, Alexa Voice Remote Lite, smart home controls, HD streaming",$17.99,$24.99,USD,4.4,1996,https://www.amazon.com/dp/B091GJ72FP,https://m.media-amazon.com/images/I/41DTzx56EWL._AC_UY654_FMwebp_QL65_.jpg,1,$17.99,False,False,True,False,2K+ bought in past month,"FREE delivery Tue, Oct 22 on $35 of items shipped by AmazonOr fastest delivery Sat, Oct 19",False,,,,
34,B09L45VFCN,Ring Chime,$34.99,,USD,4.6,38934,https://www.amazon.com/dp/B09L45VFCN,https://m.media-amazon.com/images/I/61OIHg12JiL._AC_UY654_FMwebp_QL65_.jpg,4,$34.64,True,False,True,False,10K+ bought in past month,"FREE delivery Wed, Oct 23 on $35 of items shipped by AmazonOr fastest delivery Mon, Oct 21",False,,,,
35,B0DDM3PGVF,INSIGNIA 70-inch Class F50 Series LED 4K UHD Smart Fire TV with Alexa Voice Remote (NS-70F501NA25),$379.99,$499.99,USD,3.6,13,https://www.amazon.com/dp/B0DDM3PGVF,https://m.media-amazon.com/images/I/71H98Uh0mhL._AC_UY654_FMwebp_QL65_.jpg,1,$379.99,False,False,False,False,2K+ bought in past month,FREE delivery Oct 23 - 31 Or FREE pickup Tomorrow ready by 12 PM,False,,,,
36,B0CG6VFFVL,"Ring Floodlight Cam Wired Pro with Bird’s Eye View and 3D Motion Detection, White",$249.99,,USD,4.6,9430,https://www.amazon.com/dp/B0CG6VFFVL,https://m.media-amazon.com/images/I/717eVlQ7zmL._AC_UY654_FMwebp_QL65_.jpg,2,$208.24,False,False,True,True,5K+ bought in past month,"FREE delivery Tue, Oct 22 Or fastest delivery Sat, Oct 19",True,,,,
37,B0CG2JMX5X,All-new Ring No-Drill Mount for Battery Doorbell,$19.99,,USD,4.3,10656,https://www.amazon.com/dp/B0CG2JMX5X,https://m.media-amazon.com/images/I/41DYTjx2nML._AC_UY654_FMwebp_QL65_.jpg,2,$19.19,False,False,True,False,10K+ bought in past month,"FREE delivery Tue, Oct 22 on $35 of items shipped by AmazonOr fastest delivery Sat, Oct 19",False,,,,
38,B0D5KPDR1X,"New Amazon Kindle Scribe Folio Cover with Magnetic Attach, Sleek Protective Case - Premium Leather",$99.99,,USD,,0,https://www.amazon.com/dp/B0D5KPDR1X,https://m.media-amazon.com/images/I/71my1+BgvML._AC_UY654_FMwebp_QL65_.jpg,1,$99.99,False,False,True,False,Also available in Black,"FREE delivery Wed, Dec 18 Or fastest delivery Thu, Dec 12 This item will be released on December 4, 2024.",False,,,,
39,B0CG2VS5FD,"Introducing Ring Pan-Tilt Indoor Cam | See all around with 360° pan coverage, HD video, plus Two-Way Talk (2024 release) | White",$79.99,,USD,4.6,690,https://www.amazon.com/dp/B0CG2VS5FD,https://m.media-amazon.com/images/I/518jC2FOAYL._AC_UY654_FMwebp_QL65_.jpg,1,$79.99,False,False,True,True,10K+ bought in past month,"FREE delivery Mon, Oct 21 Or fastest delivery Fri, Oct 18",True,,,,
40,B0D4P1T8RV,"TCL 75-Inch Class S5 UHD 4K LED Smart TV with Fire TV (75S551F, 2024 Model), Dolby Vision, HDR PRO+, Dolby Atmos, Alexa Built-in with Voice Remote, Apple AirPlay 2 Compatibility, Streaming Television",$519.99,$649.99,USD,4,199,https://www.amazon.com/dp/B0D4P1T8RV,https://m.media-amazon.com/images/I/71ByP+FObYL._AC_UY654_FMwebp_QL65_.jpg,2,$493.99,False,False,False,False,1K+ bought in past month,"FREE delivery as soon as Thu, Oct 24, 8 AM - 8 PM",False,,,,
41,B0BCMND272,INSIGNIA 42-inch Class F20 Series Smart Full HD 1080p Fire TV with Alexa Voice Remote (NS-42F201NA23),$129.99,$179.99,USD,4.5,8999,https://www.amazon.com/dp/B0BCMND272,https://m.media-amazon.com/images/I/81-WrIFjNiL._AC_UY654_FMwebp_QL65_.jpg,1,$129.99,False,False,False,False,10K+ bought in past month,FREE delivery Oct 21 - 24 Or FREE pickup Tomorrow ready by 12 PM,False,,,,
42,B0CFPNV5KM,All-new Amazon Kindle Paperwhite Kids (16 GB) – larger 7&quot; glare-free display – Kids read an average of 1+ hour per day with Kindle – Cyber City,$179.99,,USD,,0,https://www.amazon.com/dp/B0CFPNV5KM,https://m.media-amazon.com/images/I/71YAm9kzxLL._AC_UY654_FMwebp_QL65_.jpg,1,$179.99,False,False,True,True,50+ bought in past month,"FREE delivery Wed, Oct 23",False,,,,
43,B089DR29T6,"Amazon Smart Plug | Works with Alexa | Simple setup, endless possibilities",$24.99,,USD,4.7,564736,https://www.amazon.com/dp/B089DR29T6,https://m.media-amazon.com/images/I/411tekLceiL._AC_UY654_FMwebp_QL65_.jpg,1,$24.99,False,False,True,True,10K+ bought in past month,"FREE delivery Tue, Oct 22 on $35 of items shipped by AmazonOr fastest delivery Sat, Oct 19",False,,,,
44,B096WJFX8M,"Amazon Fire 7 tablet (newest model) 7” display, read and watch, under $80 with 10-hour battery life, 32 GB, Black",$49.99,$79.99,USD,4.4,17587,https://www.amazon.com/dp/B096WJFX8M,https://m.media-amazon.com/images/I/51092zEMKaL._AC_UY654_FMwebp_QL65_.jpg,1,$49.99,True,False,True,True,10K+ bought in past month,"FREE delivery Mon, Oct 21 Or fastest delivery Fri, Oct 18",True,,,,
45,B076JKHDQT,Ring Rechargeable Quick Release Battery Pack,$34.99,,USD,4.7,125926,https://www.amazon.com/dp/B076JKHDQT,https://m.media-amazon.com/images/I/51kpytThp1L._AC_UY654_FMwebp_QL65_.jpg,5,$27.64,False,False,True,False,10K+ bought in past month,"FREE delivery Tue, Oct 22 on $35 of items shipped by AmazonOr fastest delivery Sat, Oct 19",False,,,,
46,B0CVDN4QS6,"New Amazon Fire HD 8 tablet, 8” HD Display, 3GB memory, 32GB, designed for portable entertainment, Black, (2024 release)",$99.99,,USD,4,33,https://www.amazon.com/dp/B0CVDN4QS6,https://m.media-amazon.com/images/I/71+l3bvTqTL._AC_UY654_FMwebp_QL65_.jpg,1,$99.99,False,False,True,True,7K+ bought in past month,"FREE delivery Wed, Oct 23 Or fastest delivery Fri, Oct 18",False,,,,
47,B0CNVBS5JN,"New Amazon Kindle Kids (16 GB) - If it breaks, we will replace it, includes ad-free books and cover, with glare-free display, faster page turns - Ocean Explorer",$129.99,,USD,,0,https://www.amazon.com/dp/B0CNVBS5JN,https://m.media-amazon.com/images/I/716Y7yx9+aL._AC_UY654_FMwebp_QL65_.jpg,1,$129.99,False,False,True,False,,"FREE delivery Wed, Oct 23 Or fastest delivery Tue, Oct 22",False,,,,
48,B09ZLTMWWH,INSIGNIA 32-inch Class F20 Series Smart HD 720p Fire TV with Alexa Voice Remote (NS-32F201NA23),$79.99,$129.99,USD,4.5,23100,https://www.amazon.com/dp/B09ZLTMWWH,https://m.media-amazon.com/images/I/815E5aShTqL._AC_UY654_FMwebp_QL65_.jpg,1,$79.99,True,False,False,False,10K+ bought in past month,FREE delivery Oct 21 - 24 Or FREE pickup Tomorrow ready by 12 PM,False,,,,
49,B0BTDYTRP4,"Certified Refurbished Ring Indoor Cam (2nd Gen) | latest generation | 1080p HD Video &amp; Color Night Vision, Two-Way Talk, and Manual Audio &amp; Video Privacy Cover | White",$29.99,$49.99,USD,4.6,537,https://www.amazon.com/dp/B0BTDYTRP4,https://m.media-amazon.com/images/I/51keHnu-7YL._AC_UY654_FMwebp_QL65_.jpg,1,$29.99,False,False,True,False,500+ bought in past month,"FREE delivery Tue, Oct 22 on $35 of items shipped by AmazonOr fastest delivery Fri, Oct 18",True,,,,
50,B07X6C9RMF,"Blink Mini – Compact indoor plug-in smart security camera, 1080p HD video, night vision, motion detection, two-way audio, easy set up, Works with Alexa – 1 camera (White)",$29.99,,USD,4.4,292880,https://www.amazon.com/dp/B07X6C9RMF,https://m.media-amazon.com/images/I/31k4JysPQ5L._AC_UY500_FMwebp_QL65_.jpg,1,$29.99,False,False,True,True,10K+ bought in past month,"FREE delivery Mon, Oct 21 on $35 of items shipped by AmazonOr fastest delivery Fri, Oct 18",True,,,,
51,B0D2FBN1W8,"New Amazon Kindle Scribe Premium Pen, Sleek Stylus Design with Improved Eraser - Tungsten",$79.99,,USD,,0,https://www.amazon.com/dp/B0D2FBN1W8,https://m.media-amazon.com/images/I/41XSWepOstL._AC_UY654_FMwebp_QL65_.jpg,1,$79.99,False,False,True,False,Also available in Metallic Jade,"FREE delivery Wed, Dec 18 Or fastest delivery Thu, Dec 12 This item will be released on December 4, 2024.",False,,,,
52,B08JHG867P,Blink Subscription Plus Plan with yearly auto-renewal,$100.00,,USD,4.4,230723,https://www.amazon.com/dp/B08JHG867P,https://m.media-amazon.com/images/I/316iIKOVz7L._AC_UY654_FMwebp_QL65_.png,1,$100.00,False,False,False,False,($100.00$100.00/year),,False,$100.00,1.0,,
53,B0CNY22DJP,2-Year Protection Plan for Kindle,$16.99,,USD,,0,https://www.amazon.com/dp/B0CNY22DJP,https://m.media-amazon.com/images/I/61pr8jEqv6L._AC_UY654_FMwebp_QL65_.jpg,1,$16.99,False,False,False,False,,FREE delivery Oct 22 - 24,False,,,,
54,B091G4YP57,"Amazon Fire TV Stick Lite, free and live TV, Alexa Voice Remote Lite, smart home controls, HD streaming",$29.99,,USD,4.6,71788,https://www.amazon.com/dp/B091G4YP57,https://m.media-amazon.com/images/I/41DTzx56EWL._AC_UY654_FMwebp_QL65_.jpg,1,$29.99,False,False,True,True,10K+ bought in past month,"FREE delivery Mon, Oct 21 on $35 of items shipped by AmazonOr fastest delivery Fri, Oct 18",False,,,,
55,B0D4FCG9MX,"Amazon Signage Stick - digital signage media player - quad-core SoC, 4K video streaming and playback, WiFi 6E",$99.99,,USD,3.5,3,https://www.amazon.com/dp/B0D4FCG9MX,https://m.media-amazon.com/images/I/61AAryt2KXL._AC_UY654_FMwebp_QL65_.jpg,1,$99.99,False,False,True,False,100+ bought in past month,"FREE delivery Wed, Oct 23 Or fastest delivery Fri, Oct 18",False,,,,
56,B08F6GPQQ7,"Ring Floodlight Cam Wired Plus with motion-activated 1080p HD video, White (2021 release)",$199.99,,USD,4.7,37185,https://www.amazon.com/dp/B08F6GPQQ7,https://m.media-amazon.com/images/I/51TdAAWxGnS._AC_UY654_FMwebp_QL65_.jpg,3,$127.83,False,False,True,True,10K+ bought in past month,"FREE delivery Mon, Oct 21 Or fastest delivery Fri, Oct 18",True,,,,
57,B0B1VQ1ZQY,"Amazon Fire Max 11 tablet (newest model) vivid 11” display, all-in-one for streaming, reading, and gaming, 14-hour battery life, optional stylus and keyboard, 64 GB, Gray",$149.99,$229.99,USD,4.4,10086,https://www.amazon.com/dp/B0B1VQ1ZQY,https://m.media-amazon.com/images/I/51gj5oQXbnL._AC_UY654_FMwebp_QL65_.jpg,1,$149.99,False,False,True,True,10K+ bought in past month,"FREE delivery Tue, Oct 22 Or fastest delivery Fri, Oct 18",False,,,,
58,B09JZ5BG26,"Ring Spotlight Cam Plus, Battery | Two-Way Talk, Color Night Vision, and Security Siren (2022 release) - White",$169.99,,USD,4.5,13606,https://www.amazon.com/dp/B09JZ5BG26,https://m.media-amazon.com/images/I/61ZtK6Lp4NL._AC_UY654_FMwebp_QL65_.jpg,3,$119.31,False,False,True,True,10K+ bought in past month,"FREE delivery Tue, Oct 22 Or fastest delivery Fri, Oct 18",True,,,,
59,B0D488N6BL,"Blink Outdoor 4 + Blink Mini 2 — Smart security cameras, two-way talk, HD live view, motion detection, set up in minutes, Works with Alexa — 3 camera system + Mini 2 (Black)",$299.98,,USD,4.5,52,https://www.amazon.com/dp/B0D488N6BL,https://m.media-amazon.com/images/I/41LfOltTYrL._AC_UY654_FMwebp_QL65_.jpg,1,$299.98,False,False,False,False,,FREE delivery,False,,,,
60,B084RQ6MHJ,Blink Add-On Sync Module 2,$49.99,,USD,4.4,42789,https://www.amazon.com/dp/B084RQ6MHJ,https://m.media-amazon.com/images/I/41m2PbpDd4L._AC_UY654_FMwebp_QL65_.jpg,1,$49.99,True,False,True,False,10K+ bought in past month,"FREE delivery Tue, Oct 22 Or fastest delivery Sat, Oct 19",False,,,,
61,B0D8JYNTNK,Echo Pop with TP-Link Tapo Smart Color Bulb,$39.99,$64.98,USD,4.5,68,https://www.amazon.com/dp/B0D8JYNTNK,https://m.media-amazon.com/images/I/61MA7ki6AGL._AC_UY654_FMwebp_QL65_.jpg,1,$39.99,False,False,False,False,List: ,FREE delivery,False,,,,
62,B01I0IGFKC,"Amazon 9W Official OEM USB Charger and Power Adapter for Fire Tablets, Kindle eReaders, and Echo Dot",$19.99,,USD,4.7,15240,https://www.amazon.com/dp/B01I0IGFKC,https://m.media-amazon.com/images/I/81hss7SMd7L._AC_UY654_FMwebp_QL65_.jpg,4,$18.04,False,False,True,False,10K+ bought in past month,"FREE delivery Mon, Oct 21 on $35 of items shipped by AmazonOr fastest delivery Fri, Oct 18",False,,,,
63,B09WZBPX7K,"Ring Battery Doorbell Plus | Head-to-Toe HD+ Video, motion detection &amp; alerts, and Two-Way Talk (2023 release)",$149.99,,USD,4.6,8551,https://www.amazon.com/dp/B09WZBPX7K,https://m.media-amazon.com/images/I/61MBp1T6huL._AC_UY654_FMwebp_QL65_.jpg,8,$103.49,False,False,True,True,10K+ bought in past month,"FREE delivery Mon, Oct 21 Or fastest delivery Fri, Oct 18",False,,,,
