,asin,product_title,product_price,product_original_price,currency,product_star_rating,product_num_ratings,product_url,product_photo,product_num_offers,product_minimum_offer_price,is_best_seller,is_amazon_choice,is_prime,climate_pledge_friendly,sales_volume,delivery,has_variations,unit_price,unit_count,product_availability,coupon_text
398,B09Z7HXTRT,"Made For Amazon, 15W Type-C Wall Charger with USB-C Cable",$24.99,,USD,4.6,1289,https://www.amazon.com/dp/B09Z7HXTRT,https://m.media-amazon.com/images/I/511Z4ph8z-L._AC_UY654_FMwebp_QL65_.jpg,1,$24.99,False,False,True,False,500+ bought in past month,"FREE delivery Tue, Oct 22 on $35 of items shipped by AmazonOr fastest delivery Fri, Oct 18",False,,,,
399,B07L3H39CD,"Ring Smart Lighting – Spotlight, Battery-Powered, Outdoor Motion-Sensor Security Light, White (Starter Kit: 2-pack)",$99.99,$129.97,USD,4.4,5177,https://www.amazon.com/dp/B07L3H39CD,https://m.media-amazon.com/images/I/71dLZhanrpL._AC_UY654_FMwebp_QL65_.jpg,1,$99.99,False,False,False,True,Was: ,FREE delivery,True,,,,
400,B085RVS6FV,"Made for Amazon, Wireless Charging Dock for Amazon Fire HD 8 Plus (2022 &amp; 2020 Releases)",$39.99,$49.99,USD,4.5,10176,https://www.amazon.com/dp/B085RVS6FV,https://m.media-amazon.com/images/I/81wUrjUDx4L._AC_UY654_FMwebp_QL65_.jpg,1,$39.99,False,False,True,False,2K+ bought in past month,"FREE delivery Tue, Oct 22 Or fastest delivery Fri, Oct 18",False,,,,
401,B08B44QFJJ,Blink Camera Stand – Black – 1 Pack,$9.99,,USD,4.4,910,https://www.amazon.com/dp/B08B44QFJJ,https://m.media-amazon.com/images/I/4189QbS8aOL._AC_UY654_FMwebp_QL65_.jpg,1,$9.99,False,False,True,False,100+ bought in past month,"FREE delivery Mon, Oct 21 on $35 of items shipped by AmazonOr fastest delivery Fri, Oct 18",False,,,,
402,B0875FJCR2,"Made for Amazon Volume Limiting Bluetooth BuddyPhones, PlayTime in Blue. Ages (3-7)",,,,4.5,4864,https://www.amazon.com/dp/B0875FJCR2,https://m.media-amazon.com/images/I/61Xe3e4vsKL._AC_UY654_FMwebp_QL65_.jpg,1,,False,False,False,False,,,False,,,,
403,B0BNPFPL7D,"Tempered Glass Screen Protector (1 Pack), for Amazon Fire HD 10, (13th Gen, 2023 release)",$19.99,,USD,4.3,21,https://www.amazon.com/dp/B0BNPFPL7D,https://m.media-amazon.com/images/I/51N06U6nj7L._AC_UY654_FMwebp_QL65_.jpg,1,$19.99,False,False,True,False,,"FREE delivery Tue, Oct 22 on $35 of items shipped by AmazonOr fastest delivery Fri, Oct 18",False,,,,
404,B097W14FV3,Ring Pole Mount for Cameras and Solar Panels - White,$24.99,,USD,4.5,629,https://www.amazon.com/dp/B097W14FV3,https://m.media-amazon.com/images/I/21lOoLE2XfL._AC_UY480_FMwebp_QL65_.jpg,1,$24.99,False,False,True,False,400+ bought in past month,"FREE delivery Mon, Oct 21 on $35 of items shipped by AmazonOr fastest delivery Fri, Oct 18",False,,,,
405,B0C2RV76LD,"Blink Wired Floodlight Camera + Video Doorbell | Two-way audio, HD day and night video, motion detection, works with Alexa — (White)",$149.98,,USD,4.4,99,https://www.amazon.com/dp/B0C2RV76LD,https://m.media-amazon.com/images/I/41ZUtPIfVUL._AC_UY654_FMwebp_QL65_.jpg,1,$149.98,False,False,False,False,,FREE delivery,False,,,,
406,B0BFCJF66B,Echo Auto (2nd Gen) with Adjustable Car Vent Mount for Echo Auto,$62.98,,USD,4.3,230,https://www.amazon.com/dp/B0BFCJF66B,https://m.media-amazon.com/images/I/51oKxfNvMFL._AC_UY654_FMwebp_QL65_.jpg,1,$62.98,False,False,False,False,,FREE delivery,False,,,,
407,B09SVGPSHC,2-Year Protection plan for Echo Frames,$39.99,,USD,5,1,https://www.amazon.com/dp/B09SVGPSHC,https://m.media-amazon.com/images/I/51WE5QGMk9L._AC_UY654_FMwebp_QL65_.jpg,1,$39.99,False,False,False,False,50+ bought in past month,FREE delivery Oct 22 - 24,False,,,,
408,B09X2277HJ,2-Year Protection Plan for Echo Auto,$4.99,,USD,2.3,4,https://www.amazon.com/dp/B09X2277HJ,https://m.media-amazon.com/images/I/51K6xhRhu4L._AC_UY654_FMwebp_QL65_.jpg,1,$4.99,False,False,False,False,50+ bought in past month,FREE delivery Oct 22 - 24,False,,,,
409,B0B2B25S9L,WiZ 65W BR30 Tunable White LED Smart Bulb - Pack of 1 - E26- Indoor - Connects to Your Existing Wi-Fi - Control with Voice or App + Activate with Motion - Matter Compatible,$9.34,$10.99,USD,4,72,https://www.amazon.com/dp/B0B2B25S9L,https://m.media-amazon.com/images/I/71Cygejl4KL._AC_UY654_FMwebp_QL65_.jpg,1,$9.34,False,True,True,False,List: ,"FREE delivery Mon, Oct 28 on $35 of items shipped by AmazonOr fastest delivery Tue, Oct 22 Only 3 left in stock - order soon.",False,,,Only 3 left in stock - order soon.,
410,B0036UU40C,Ozeri Kandle Book Light - LED Reading Light Designed for Books and eReaders.,$11.87,$39.99,USD,4,972,https://www.amazon.com/dp/B0036UU40C,https://m.media-amazon.com/images/I/71+LylhWckL._AC_UY654_FMwebp_QL65_.jpg,1,$11.87,False,False,True,False,50+ bought in past month,"FREE delivery Tue, Oct 22 on $35 of items shipped by AmazonOr fastest delivery Sat, Oct 19",True,,,,
411,B0BXFWJ63S,"Certified Refurbished Amazon Fire TV Stick 4K streaming device, more than 1.5 million movies and TV episodes, supports Wi-Fi 6, watch free &amp; live TV",$44.99,,USD,4.3,726,https://www.amazon.com/dp/B0BXFWJ63S,https://m.media-amazon.com/images/I/41vhe0X8wbL._AC_UY654_FMwebp_QL65_.jpg,1,$44.99,False,False,False,False,6K+ bought in past month,FREE deliveryOnly 1 left in stock - order soon.,False,,,Only 1 left in stock - order soon.,
412,B07ZDTXJ93,Ring Alarm 5-Piece Kit - home security system with 30-day free Ring Protect Pro subscription,$199.99,,USD,4.7,5084,https://www.amazon.com/dp/B07ZDTXJ93,https://m.media-amazon.com/images/I/61bznE2W8iL._AC_UY654_FMwebp_QL65_.jpg,1,$199.99,False,False,True,True,1K+ bought in past month,"FREE delivery Wed, Oct 23",False,,,,
413,B095359GTP,Made for Amazon Universal Full-Motion TV Wall Mount for TVs up to 55&quot; and Compatible with Amazon Fire TVs,$34.78,$37.28,USD,4.6,938,https://www.amazon.com/dp/B095359GTP,https://m.media-amazon.com/images/I/71xK-De+mLL._AC_UY654_FMwebp_QL65_.jpg,4,$29.64,False,False,True,False,500+ bought in past month,"FREE delivery Tue, Oct 22 on $35 of items shipped by AmazonOr fastest delivery Fri, Oct 18",False,,,,
414,B08N37F83S,Ring PoE Adapter (2nd Gen) - Black,$24.99,,USD,4.2,39,https://www.amazon.com/dp/B08N37F83S,https://m.media-amazon.com/images/I/41-rwmD8QmL._AC_UY654_FMwebp_QL65_.jpg,2,$23.99,False,False,True,False,More Buying Choices,"FREE delivery Tue, Oct 22 on $35 of items shipped by AmazonOr fastest delivery Fri, Oct 18",False,,,,
415,B0CXF1PVNV,"Amazon Kid-Proof Case for Fire HD 8 tablet (Only compatible with 12th generation tablet), Disney Princess",$34.99,,USD,4.7,527,https://www.amazon.com/dp/B0CXF1PVNV,https://m.media-amazon.com/images/I/71pOQJ-7ynL._AC_UY654_FMwebp_QL65_.jpg,1,$34.99,False,False,True,False,Price may vary by color,"FREE delivery Wed, Oct 23 on $35 of items shipped by AmazonOr fastest delivery Mon, Oct 21",False,,,,
416,B0BLL4W9WB,Made For Amazon Sleeve for Echo Pop (2023 Release),$16.99,,USD,4.6,992,https://www.amazon.com/dp/B0BLL4W9WB,https://m.media-amazon.com/images/I/61aG7fxkxBL._AC_UY654_FMwebp_QL65_.jpg,1,$16.99,False,False,True,True,Shop products from small business brands sold in Amazon’s store. Discover more about the small businesses partnering with Amazon and Amazon’s commitment to empowering them.,"FREE delivery Tue, Oct 22 on $35 of items shipped by AmazonOr fastest delivery Sat, Oct 19",False,,,,
417,B0BRRXP8C4,"All-new Ring Indoor Cam, White with Ring Video Doorbell Wired",$109.98,,USD,4.6,50,https://www.amazon.com/dp/B0BRRXP8C4,https://m.media-amazon.com/images/I/41FOE7ZqcSL._AC_UY654_FMwebp_QL65_.jpg,1,$109.98,False,False,False,False,,FREE delivery,False,,,,
418,B0BLTWYG5C,"Made for Amazon Shelf Wall Mount, for Echo Pop (2023 Release)",$16.99,,USD,4.6,1329,https://www.amazon.com/dp/B0BLTWYG5C,https://m.media-amazon.com/images/I/61Oe4V2oa+L._AC_UY654_FMwebp_QL65_.jpg,11,$10.03,False,False,True,False,500+ bought in past month,"FREE delivery Mon, Oct 21 on $35 of items shipped by AmazonOr fastest delivery Fri, Oct 18",False,,,,
419,B09HJJN7MS,"Amazon eero Max 7 mesh wifi router | Wireless speeds up to 4.3 Gbps | Coverage up to 2,500 sq. ft. | Connect 200+ devices | Ideal for Gaming | 1-Pack | Latest Gen",$599.99,,USD,4.1,387,https://www.amazon.com/dp/B09HJJN7MS,https://m.media-amazon.com/images/I/41jrzcBgilL._AC_UY654_FMwebp_QL65_.jpg,1,$599.99,False,False,True,True,This product is certified by Amazon to work with Alexa. This product can be controlled with your voice through Alexa-enabled devices such as Amazon Echo and Amazon Tap.,"FREE delivery Mon, Oct 21 Or fastest delivery Fri, Oct 18",False,,,,
420,B08GDFJBD3,"Made for Amazon Extension Cable, 10’ (3M) Length in White, for Echo (4th Gen)",$12.99,,USD,4.4,246,https://www.amazon.com/dp/B08GDFJBD3,https://m.media-amazon.com/images/I/61sj7pYZnkL._AC_UY654_FMwebp_QL65_.jpg,2,$11.95,False,False,True,False,50+ bought in past month,"FREE delivery Wed, Oct 23 on $35 of items shipped by AmazonOr fastest delivery Sun, Oct 20",False,,,,
421,B0CYVHNM44,Ring Battery Doorbell with Ring Stick Up Cam Battery (White),$179.99,$199.98,USD,,0,https://www.amazon.com/dp/B0CYVHNM44,https://m.media-amazon.com/images/I/61Ky1Xd5g1L._AC_UY654_FMwebp_QL65_.jpg,1,$179.99,False,False,False,False,Was: ,FREE delivery,False,,,,
422,B07KXPDML3,"Ring Smart Lighting – Pathlight, Battery-Powered, Outdoor Motion-Sensor Security Light, Black (Bridge required)",$29.99,,USD,4.5,3423,https://www.amazon.com/dp/B07KXPDML3,https://m.media-amazon.com/images/I/61IZy8d6UoL._AC_UY654_FMwebp_QL65_.jpg,1,$29.99,False,False,True,True,500+ bought in past month,"FREE delivery Mon, Oct 21 on $35 of items shipped by AmazonOr fastest delivery Fri, Oct 18",False,,,,
423,B07WMMD6DD,Certified Refurbished Amazon eero mesh WiFi router,$55.99,,USD,4.4,2025,https://www.amazon.com/dp/B07WMMD6DD,https://m.media-amazon.com/images/I/41fu0zjxqQL._AC_UY654_FMwebp_QL65_.jpg,1,$55.99,False,False,True,True,1K+ bought in past month,"FREE delivery Wed, Oct 23 Or fastest delivery Sat, Oct 19",False,,,,
424,B0865XD3C6,"Power Cord Replacement for Alexa Show 8, Show 2nd Gen, Show 10 (3rd Gen) and Plus 2nd Gen, 30W Charger",$11.99,,USD,4.4,577,https://www.amazon.com/dp/B0865XD3C6,https://m.media-amazon.com/images/I/61OnVaLphEL._AC_UY654_FMwebp_QL65_.jpg,1,$11.99,False,False,True,False,100+ bought in past month,"FREE delivery Mon, Oct 21 on $35 of items shipped by AmazonOr fastest delivery Fri, Oct 18",False,,,,
425,B08MR346LT,2-Year Protection Plan for Fire TV Stick 4K Max,$5.49,,USD,4.6,2507,https://www.amazon.com/dp/B08MR346LT,https://m.media-amazon.com/images/I/61f8Fvn8VLL._AC_UY654_FMwebp_QL65_.jpg,1,$5.49,False,False,False,False,,FREE delivery Oct 22 - 24,False,,,,
426,B01G1LFS08,"Beams MB720A 20 Lumen Amber LED Sleep Friendly Wireless Battery Powered Motion Sensing Nightlight, 3-Pack, White",$29.99,,USD,4.5,5673,https://www.amazon.com/dp/B01G1LFS08,https://m.media-amazon.com/images/I/51PyAxfSxqL._AC_UY654_FMwebp_QL65_.jpg,1,$29.99,False,False,True,False,500+ bought in past month,"FREE delivery Tue, Oct 22 on $35 of items shipped by AmazonOr fastest delivery Sat, Oct 19",False,$10.00,3.0,,
427,B09BK7CY13,Blink Solar Panel 13 Foot Extension Cable — Black,$12.99,,USD,4.3,174,https://www.amazon.com/dp/B09BK7CY13,https://m.media-amazon.com/images/I/51rUdH-dVcL._AC_UY654_FMwebp_QL65_.jpg,1,$12.99,False,False,True,False,,"FREE delivery Mon, Oct 21 on $35 of items shipped by AmazonOr fastest delivery Fri, Oct 18",False,,,,
428,B07KD7FB5L,"Fire HD 10 Tablet (10.1&quot; 1080p full HD display, 64 GB) – Twilight Blue (2019 Release)",,,,4.6,207816,https://www.amazon.com/dp/B07KD7FB5L,https://m.media-amazon.com/images/I/713EWUU7IsL._AC_UY654_FMwebp_QL65_.jpg,1,,False,False,False,False,,,True,,,,
429,B09MV5NVZQ,4-Year Protection plan for Fire TV 50&quot; Omni QLED,$55.99,$74.99,USD,2.8,2,https://www.amazon.com/dp/B09MV5NVZQ,https://m.media-amazon.com/images/I/616ERTld7rL._AC_UY654_FMwebp_QL65_.jpg,1,$55.99,False,False,False,False,50+ bought in past month,FREE delivery Oct 22 - 24,False,,,,
430,B0CGL6B3YZ,Standing Remote Cover for Alexa Voice Remote (2022 Release) | Glow in the Dark,$16.99,$19.99,USD,4.6,32,https://www.amazon.com/dp/B0CGL6B3YZ,https://m.media-amazon.com/images/I/713vDm8mduL._AC_UY654_FMwebp_QL65_.jpg,1,$16.99,False,False,True,False,Typical: ,"FREE delivery Tue, Oct 22 on $35 of items shipped by AmazonOr fastest delivery Sat, Oct 19",False,,,,
431,B0D934R2KG,Ring Battery Doorbell with Ring Floodlight Cam Wired Plus (Black),$299.98,,USD,5,1,https://www.amazon.com/dp/B0D934R2KG,https://m.media-amazon.com/images/I/61mv5dtCaGL._AC_UY654_FMwebp_QL65_.jpg,1,$299.98,False,False,False,False,,FREE delivery,False,,,,
432,B08PDC7Y5S,"Made for Amazon Remote Cover Case, for Alexa Voice Remote (3rd Gen) - Blue",$14.99,,USD,4.7,13223,https://www.amazon.com/dp/B08PDC7Y5S,https://m.media-amazon.com/images/I/61tJyTjidlL._AC_UY654_FMwebp_QL65_.jpg,1,$14.99,False,False,True,True,50+ bought in past month,"FREE delivery Mon, Oct 28 on $35 of items shipped by AmazonOr fastest delivery Tue, Oct 22",False,,,,
433,B07TC6BW9X,2-Year Protection Plan plus Accident Protection for Echo Studio (delivered via e-mail),$17.99,,USD,4.5,466,https://www.amazon.com/dp/B07TC6BW9X,https://m.media-amazon.com/images/I/51PEPzup4vL._AC_UY654_FMwebp_QL65_.jpg,1,$17.99,False,False,False,False,100+ bought in past month,FREE delivery Oct 22 - 24,False,,,,
434,B099LFLKMP,"Made for Amazon Tilt and Swivel Stand, for the Echo Show 15",$43.99,,USD,4.7,3788,https://www.amazon.com/dp/B099LFLKMP,https://m.media-amazon.com/images/I/61piXjcDBzL._AC_UY654_FMwebp_QL65_.jpg,25,$25.01,False,False,True,False,500+ bought in past month,"FREE delivery Mon, Oct 21 Or fastest delivery Fri, Oct 18",False,,,,
435,B0BWKXP8X5,"Echo Buds (2023 Release) Replacement Silicone Earbud Covers, fit in case while charging",$9.99,,USD,4.1,76,https://www.amazon.com/dp/B0BWKXP8X5,https://m.media-amazon.com/images/I/31sodgW+CIL._AC_UY595_FMwebp_QL65_.jpg,1,$9.99,False,False,True,False,50+ bought in past month,"FREE delivery Wed, Oct 23 on $35 of items shipped by Amazon",False,,,,
436,B09MV6RG6N,4-Year Protection plan for Fire TV 43&quot; Omni QLED,$44.99,$59.99,USD,2.8,5,https://www.amazon.com/dp/B09MV6RG6N,https://m.media-amazon.com/images/I/616ERTld7rL._AC_UY654_FMwebp_QL65_.jpg,1,$44.99,False,False,False,False,50+ bought in past month,FREE delivery Oct 22 - 24,False,,,,
437,B0C67F4KSY,"Blink Wired Floodlight Camera + Video Doorbell with Sync Module 2 | Two-way audio, HD day and night video, motion detection, Works with Alexa — (Black)",$159.98,,USD,4.4,51,https://www.amazon.com/dp/B0C67F4KSY,https://m.media-amazon.com/images/I/41VGE7cbd5L._AC_UY654_FMwebp_QL65_.jpg,1,$159.98,False,False,False,False,,FREE delivery,False,,,,
438,B0CFCDWMKH,Made for Amazon Rotating Wall Mount for Echo Show 15,$29.99,,USD,4.5,113,https://www.amazon.com/dp/B0CFCDWMKH,https://m.media-amazon.com/images/I/611eULgYnsL._AC_UY654_FMwebp_QL65_.jpg,13,$17.09,False,False,True,False,100+ bought in past month,"FREE delivery Wed, Oct 23 on $35 of items shipped by AmazonOr fastest delivery Tue, Oct 22",False,,,,
439,B0C2S33D2D,"Blink Wired Floodlight Camera + Video Doorbell with Sync Module 2 | Two-way audio, HD day and night video, motion detection, works with Alexa — (White)",$159.98,,USD,4.5,134,https://www.amazon.com/dp/B0C2S33D2D,https://m.media-amazon.com/images/I/41zRan6Th4L._AC_UY654_FMwebp_QL65_.jpg,1,$159.98,False,False,False,False,,FREE delivery,False,,,,
440,B09RV53551,"Made for Amazon Battery Base, for Echo Dot (4th &amp; 5th generation)",$39.99,,USD,4.5,5636,https://www.amazon.com/dp/B09RV53551,https://m.media-amazon.com/images/I/51PvrSMH8JL._AC_UY654_FMwebp_QL65_.jpg,17,$16.64,False,False,True,True,500+ bought in past month,"FREE delivery Tue, Oct 22 Or fastest delivery Sat, Oct 19",False,,,,
441,B071DXKSCY,"Protected by Blink Video Security Window Decals, Pack of 3",$8.99,,USD,4.4,2448,https://www.amazon.com/dp/B071DXKSCY,https://m.media-amazon.com/images/I/41Y6Trxxe1L._AC_UY500_FMwebp_QL65_.jpg,1,$8.99,False,False,True,False,300+ bought in past month,"FREE delivery Tue, Oct 22 on $35 of items shipped by AmazonOr fastest delivery Sat, Oct 19",False,,,,
442,B0BC2C71H1,Adjustable Car Vent Mount for Echo Auto (2nd Gen),$7.99,,USD,4.4,1853,https://www.amazon.com/dp/B0BC2C71H1,https://m.media-amazon.com/images/I/31wD29be2ZL._AC_UY654_FMwebp_QL65_.jpg,6,$5.99,False,False,True,False,500+ bought in past month,"FREE delivery Thu, Oct 24 on $35 of items shipped by AmazonOr fastest delivery Wed, Oct 23",False,,,,
443,B07Z5PDS3M,Ring Peephole Cam Faceplate - Galaxy Black,$14.99,,USD,4.3,827,https://www.amazon.com/dp/B07Z5PDS3M,https://m.media-amazon.com/images/I/41BHZUuXWFL._AC_UY654_FMwebp_QL65_.jpg,1,$14.99,False,False,True,False,50+ bought in past month,"FREE delivery Fri, Oct 25 on $35 of items shipped by AmazonOr fastest delivery Tue, Oct 22",True,,,,
444,B0874DN1P7,"Made For Amazon, Smart Clock for Echo Flex",$14.99,,USD,4.6,5110,https://www.amazon.com/dp/B0874DN1P7,https://m.media-amazon.com/images/I/718rBLm-KuL._AC_UY654_FMwebp_QL65_.jpg,1,$14.99,False,False,True,False,50+ bought in past month,"FREE delivery Mon, Oct 21 on $35 of items shipped by AmazonOr fastest delivery Fri, Oct 18",False,,,,
445,B0B3PLSJRL,"Nupro Bookcover, for Kindle (2022 Release)",$19.99,,USD,4.7,6809,https://www.amazon.com/dp/B0B3PLSJRL,https://m.media-amazon.com/images/I/81BkCbbgcZL._AC_UY654_FMwebp_QL65_.jpg,1,$19.99,False,False,True,False,200+ bought in past month,"FREE delivery Mon, Oct 21 on $35 of items shipped by AmazonOr fastest delivery Fri, Oct 18",False,,,,
446,B07PYPCX21,"Remote Case/Cover for Fire TV Stick 4K,Protective Silicone Holder Lightweight[Anti Slip]ShockProof for Fire TV Cube/Fire TV(3rd Gen)Compatible with All-New 2nd Gen Alexa Voice Remote Control-Glow Blue",$12.00,,USD,4.4,3512,https://www.amazon.com/dp/B07PYPCX21,https://m.media-amazon.com/images/I/61AGYo7pgzL._AC_UY654_FMwebp_QL65_.jpg,1,$12.00,False,False,True,False,Price may vary by color,"FREE delivery Tue, Oct 22 on $35 of items shipped by AmazonOr fastest delivery Sat, Oct 19",False,,,,
447,B07JF63SJH,Made for Amazon Outlet Shelf,$19.99,,USD,4.6,15506,https://www.amazon.com/dp/B07JF63SJH,https://m.media-amazon.com/images/I/41N-Zr-7JSL._AC_UY654_FMwebp_QL65_.jpg,8,$13.41,False,False,True,False,500+ bought in past month,"FREE delivery Thu, Oct 24 on $35 of items shipped by AmazonOr fastest delivery Tue, Oct 22",False,,,,
448,B0D76X95CF,AN-MR20GA Replacement Magic Remote Control for LG Smart TV Remote LG-TV-Remote with Voice and Pointer Function Universal LG Remote for LG UHD OLED QNED NanoCell 4K 8K Models Google/Alexa,$16.77,,USD,4.8,10,https://www.amazon.com/dp/B0D76X95CF,https://m.media-amazon.com/images/I/61TnwQA0-EL._AC_UY654_FMwebp_QL65_.jpg,1,$16.77,False,False,True,False,,"FREE delivery Mon, Oct 21 on $35 of items shipped by AmazonOr fastest delivery Fri, Oct 18",False,,,,
449,B0B2B3TQM9,WiZ 60W A19 Tunable White LED Smart Bulb - Pack of 1 - E26- Indoor - Connects to Your Existing Wi-Fi - Control with Voice or App + Activate with Motion - Matter Compatible,$8.49,$9.99,USD,4.1,357,https://www.amazon.com/dp/B0B2B3TQM9,https://m.media-amazon.com/images/I/71o4ECAXTWL._AC_UY654_FMwebp_QL65_.jpg,7,$5.42,False,False,True,False,List: ,"FREE delivery Tue, Oct 22 on $35 of items shipped by AmazonOr fastest delivery Fri, Oct 18",False,,,,
450,B09VZ2T1JH,"Made For Amazon Outlet Hanger, for Echo Dot (5th generation). Not compatible with Echo Dot Clock.",$18.99,,USD,4.3,1228,https://www.amazon.com/dp/B09VZ2T1JH,https://m.media-amazon.com/images/I/51K28VgSaSL._AC_UY654_FMwebp_QL65_.jpg,10,$10.35,False,False,True,False,200+ bought in past month,"FREE delivery Tue, Oct 22 on $35 of items shipped by AmazonOr fastest delivery Sat, Oct 19",False,,,,
451,B0D8JX6ZH7,Echo Show 5 with TP-Link Tapo Smart Color Bulb,$89.99,$114.98,USD,3,4,https://www.amazon.com/dp/B0D8JX6ZH7,https://m.media-amazon.com/images/I/512+UWbF0xL._AC_UY654_FMwebp_QL65_.jpg,1,$89.99,False,False,False,False,List: ,FREE delivery,False,,,,
452,B094YXNBNL,Floodlight Mount Accessory for Blink Outdoor Camera (3rd Gen) with 2-year battery life (Black),$39.99,,USD,4.3,15841,https://www.amazon.com/dp/B094YXNBNL,https://m.media-amazon.com/images/I/41yLUxH-iKL._AC_UY654_FMwebp_QL65_.jpg,1,$39.99,False,False,True,True,500+ bought in past month,"FREE delivery Wed, Oct 23 Or fastest delivery Sat, Oct 19",False,,,,
453,B0DF15XVF8,Echo Show 8 with TP-Link Tapo Smart Color Bulb,$149.99,$174.98,USD,2.7,5,https://www.amazon.com/dp/B0DF15XVF8,https://m.media-amazon.com/images/I/51ZIuvTnj+L._AC_UY654_FMwebp_QL65_.jpg,1,$149.99,False,False,False,False,List: ,FREE delivery,False,,,,
454,B09533KXM2,Made for Amazon Universal Tilting TV Wall Mount for 50-86&quot; TVs and Compatible with Amazon Fire TVs,$59.99,,USD,4.7,1240,https://www.amazon.com/dp/B09533KXM2,https://m.media-amazon.com/images/I/71wYBBxU3yL._AC_UY654_FMwebp_QL65_.jpg,1,$59.99,False,False,True,False,500+ bought in past month,"FREE delivery Wed, Oct 23",False,,,,
455,B096BZGT11,"Made for Amazon, Clear Case with Screen Protector for Kindle Paperwhite &amp; Kindle Paperwhite Signature Edition.",$21.99,,USD,4.8,1533,https://www.amazon.com/dp/B096BZGT11,https://m.media-amazon.com/images/I/511HS8wfEmL._AC_UY654_FMwebp_QL65_.jpg,7,$11.07,False,False,True,True,300+ bought in past month,"FREE delivery Wed, Oct 23 on $35 of items shipped by AmazonOr fastest delivery Sat, Oct 19",False,,,,
456,B08FBMKWP6,Like-new Ring Wired Doorbell Pro (Video Doorbell Pro 2) – Best-in-class with cutting-edge features (existing doorbell wiring required),$127.99,$199.99,USD,4.5,671,https://www.amazon.com/dp/B08FBMKWP6,https://m.media-amazon.com/images/I/619mM1ncz4L._AC_UY654_FMwebp_QL65_.jpg,1,$127.99,False,False,True,True,1K+ bought in past month,"FREE delivery Tue, Oct 22 Or fastest delivery Fri, Oct 18",False,,,,
457,B0D934JSBF,Ring Battery Doorbell with Ring Chime,$124.99,,USD,5,4,https://www.amazon.com/dp/B0D934JSBF,https://m.media-amazon.com/images/I/41IwnSmH3PL._AC_UY654_FMwebp_QL65_.jpg,1,$124.99,False,False,False,False,,FREE delivery,False,,,,
458,B0BX79TRGC,"Amazon Kid-Friendly Case for Fire HD 10 tablet (Only compatible with 13th generation tablet, 2023 release) - Happy Day",$34.99,,USD,4.4,333,https://www.amazon.com/dp/B0BX79TRGC,https://m.media-amazon.com/images/I/51l-1cgT7BL._AC_UY654_FMwebp_QL65_.jpg,6,$29.52,False,False,True,True,200+ bought in past month,"FREE delivery Tue, Oct 22 on $35 of items shipped by AmazonOr fastest delivery Fri, Oct 18",False,,,,
459,B07YPB5JYM,"Ring Solar Steplight -- Outdoor Motion-Sensor Security Light, Black (Bridge required)",$29.99,,USD,4.4,1745,https://www.amazon.com/dp/B07YPB5JYM,https://m.media-amazon.com/images/I/51HkHPQyqtL._AC_UY654_FMwebp_QL65_.jpg,1,$29.99,False,False,True,True,200+ bought in past month,"FREE delivery Tue, Oct 22 on $35 of items shipped by AmazonOr fastest delivery Sat, Oct 19",True,,,,
460,B0946D128Y,"Ring Indoor/Outdoor Pan-Tilt Mount for Stick Up Cam Plug-In, White (Power adapter and camera not included)",$44.99,,USD,4.5,3964,https://www.amazon.com/dp/B0946D128Y,https://m.media-amazon.com/images/I/41BFHmznYLL._AC_UY654_FMwebp_QL65_.jpg,3,$44.54,False,False,True,False,1K+ bought in past month,"FREE delivery Wed, Oct 23 Or fastest delivery Mon, Oct 21",True,,,,
461,B08MN7FN9G,2-Year Protection Plan for Echo Show 15,$34.99,,USD,4.4,166,https://www.amazon.com/dp/B08MN7FN9G,https://m.media-amazon.com/images/I/615pcLdUNJL._AC_UY654_FMwebp_QL65_.jpg,1,$34.99,False,False,False,False,100+ bought in past month,FREE delivery Oct 22 - 24,False,,,,
462,B097CWX993,"NuPro Book Cover for Kindle Paperwhite, Blue (11th Gen; 2021 release)",$26.99,,USD,4.7,3645,https://www.amazon.com/dp/B097CWX993,https://m.media-amazon.com/images/I/71So4itFH2L._AC_UY654_FMwebp_QL65_.jpg,1,$26.99,False,False,True,False,50+ bought in past month,"FREE delivery Wed, Oct 23 on $35 of items shipped by AmazonOr fastest delivery Sun, Oct 20",False,,,,
463,B0CC5WMQFH,Alexa Emergency Assist Monthly (auto-renewal),$5.99,,USD,4.4,908,https://www.amazon.com/dp/B0CC5WMQFH,https://m.media-amazon.com/images/I/31PPLA1nOaL._AC_UY654_FMwebp_QL65_.png,1,$5.99,False,False,False,False,($5.99$5.99/month),,False,$5.99,1.0,,
464,B0BLL35QCZ,Made for Amazon Stand with USB-C and USB-A charging ports for Echo Pop (2023 Release),$29.99,,USD,4.5,513,https://www.amazon.com/dp/B0BLL35QCZ,https://m.media-amazon.com/images/I/61SM80Yv6HL._AC_UY654_FMwebp_QL65_.jpg,4,$22.64,False,False,True,True,100+ bought in past month,"FREE delivery Mon, Oct 21 on $35 of items shipped by AmazonOr fastest delivery Fri, Oct 18",False,,,,
465,B013EYDHLW,"NuPro Fire Screen Protector Kit (2-Pack) (5th Generation - 2015 release), Anti-Glare",$4.99,$12.99,USD,4.4,2415,https://www.amazon.com/dp/B013EYDHLW,https://m.media-amazon.com/images/I/81xbDvXbeYL._AC_UY654_FMwebp_QL65_.jpg,1,$4.99,False,False,True,False,List: ,"FREE delivery Tue, Oct 22 on $35 of items shipped by AmazonOr fastest delivery Fri, Oct 18",False,,,,
466,B0B64SBSPW,"NuPro Anti-Glare Screen Protector (2 Pack), for Kindle (2022 Release)",$15.99,,USD,4.6,2050,https://www.amazon.com/dp/B0B64SBSPW,https://m.media-amazon.com/images/I/31bsZ3MiMlL._AC_UY654_FMwebp_QL65_.jpg,1,$15.99,False,False,True,False,100+ bought in past month,"FREE delivery Wed, Oct 23 on $35 of items shipped by AmazonOr fastest delivery Sun, Oct 20",False,,,,
467,B0BKRJFJ9T,"Made For Amazon Outlet Hanger, for Echo Pop",$16.99,,USD,4.3,680,https://www.amazon.com/dp/B0BKRJFJ9T,https://m.media-amazon.com/images/I/611KdbAGlKL._AC_UY654_FMwebp_QL65_.jpg,10,$10.48,False,False,True,False,200+ bought in past month,"FREE delivery Wed, Oct 23 on $35 of items shipped by AmazonOr fastest delivery Tue, Oct 22",False,,,,
